"2023-05-25 06:25 PM;","How this improves work efficiency and saves time
Imagine you're a producer working on a highly anticipated project. You have a handful of meetings with key stakeholders, a plethora of notes, and a long list of to-dos. As the weeks go by, it becomes increasingly difficult to keep up with the flood of information and tasks that come your way. So, what do you do?
Well, many people will turn to productivity apps to help them manage their workload. However, with Raycast's new Pro subscription, you can take your productivity to the next level by utilizing AI and syncing features that are designed to help you work smarter and faster.
With Raycast's AI features, you can:
With Raycast's syncing features, you can:
https://akash.mittal.blog/Raycast-s-Pro-Subscription-Adds-AI-Syncing-Features-The-Verge.html
#trending #RaycastPro #ProductivityApps #WorkSmarterNotHarder ","","","linkedin","Akash Mittal"
