"2023-05-29 03:46 PM;","Linda Miller always thought her parenting style was unconventional, but her approach has proven to be highly effective. As a single mother of three, she had to get creative when it came to disciplining her kids. Instead of using punishment or rewards, she used conversation and active listening to help her children grow and learn.
One instance that stands out to Linda was when her youngest son, Jack, was struggling with math. Rather than hiring a tutor or offering him incentives for good grades, Linda sat down with Jack and talked through his problems. She identified that he was struggling with the concept of fractions, so she used real-life examples to explain the concept to him. They baked a cake together and talked about how fractions apply to measuring ingredients. After that, Jack's grades in math drastically improved.
While Linda's parenting style may seem unconventional, it has produced some quantifiable results. All three of her children are now successful adults who have fulfilling careers and strong relationships. Her oldest son, Tom, is a successful business owner who credits Linda's approach to parenting for his strong work ethic and decision-making abilities. Her daughter, Sarah, is a respected lawyer who uses her active listening skills to communicate effectively with clients. And her youngest son, Jack, is a talented chef who often cites his mother's baking lessons as the reason for his success in the culinary world.
Want to know the secret to successful parenting? Look no further than Linda Miller and her unconventional approach to discipline.
One of Linda's most memorable moments as a parent was when her daughter, Sarah, came to her with a problem she was facing at school. Instead of simply offering advice or telling Sarah what to do, Linda sat down with her and listened to her concerns. Together, they came up with a plan of action that made Sarah feel heard and empowered. Linda believes that this conversation was a turning point in their relationship, and from then on, Sarah felt more comfortable coming to her with any concerns she had.
https://akash.mittal.blog/The-Power-of-Parenting-How-Linda-Miller-s-Parenting-Style-Worked.html
#trending #parenting #activelistening #unconventional #singledad #conversation ","","","Facebook","Dave's Academy","","","","","","2023-05-26-03-46-29-636","https://akash.mittal.blog/The-Power-of-Parenting-How-Linda-Miller-s-Parenting-Style-Worked.html","https://akash.mittal.blog/images/The-Power-of-Parenting-How-Linda-Miller-s-Parenting-Style-Worked.jpeg"
"2023-05-29 03:46 PM;","Linda Miller always thought her parenting style was unconventional, but her approach has proven to be highly effective. As a single mother of three, she had to get creative when it came to disciplining her kids. Instead of using punishment or rewards, she used conversation and active listening to help her children grow and learn.
One instance that stands out to Linda was when her youngest son, Jack, was struggling with math. Rather than hiring a tutor or offering him incentives for good grades, Linda sat down with Jack and talked through his problems. She identified that he was struggling with the concept of fractions, so she used real-life examples to explain the concept to him. They baked a cake together and talked about how fractions apply to measuring ingredients. After that, Jack's grades in math drastically improved.
While Linda's parenting style may seem unconventional, it has produced some quantifiable results. All three of her children are now successful adults who have fulfilling careers and strong relationships. Her oldest son, Tom, is a successful business owner who credits Linda's approach to parenting for his strong work ethic and decision-making abilities. Her daughter, Sarah, is a respected lawyer who uses her active listening skills to communicate effectively with clients. And her youngest son, Jack, is a talented chef who often cites his mother's baking lessons as the reason for his success in the culinary world.
Want to know the secret to successful parenting? Look no further than Linda Miller and her unconventional approach to discipline.
One of Linda's most memorable moments as a parent was when her daughter, Sarah, came to her with a problem she was facing at school. Instead of simply offering advice or telling Sarah what to do, Linda sat down with her and listened to her concerns. Together, they came up with a plan of action that made Sarah feel heard and empowered. Linda believes that this conversation was a turning point in their relationship, and from then on, Sarah felt more comfortable coming to her with any concerns she had.
https://akash.mittal.blog/The-Power-of-Parenting-How-Linda-Miller-s-Parenting-Style-Worked.html
#trending #parenting #activelistening #unconventional #singledad #conversation ","","","linkedin","Dave's Academy","","","","","","2023-05-26-03-46-29-636","https://akash.mittal.blog/The-Power-of-Parenting-How-Linda-Miller-s-Parenting-Style-Worked.html","https://akash.mittal.blog/images/The-Power-of-Parenting-How-Linda-Miller-s-Parenting-Style-Worked.jpeg"
"2023-05-29 04:46 PM;","In the early 1900s, a new technology was introduced that would revolutionize the way people traveled: the automobile. However, with this new technology came new dangers. People were getting into accidents, sometimes fatal, and there were no regulations in place to ensure the safety of drivers and passengers. It wasn't until the government stepped in and implemented laws and regulations that the automobile could be enjoyed safely by everyone.
Artificial Intelligence (AI) is another technology that has the potential to revolutionize the world. However, like the automobile, it also comes with new dangers that need to be addressed. That's where AI governance comes in. Microsoft has created a blueprint for the future of governing AI that provides guidelines for responsible AI development and deployment.
One example of the need for AI governance is in facial recognition technology. In the past, these systems have shown bias against people of color, leading to false arrests and other injustices. In 2018, Microsoft President Brad Smith called for government regulation of this technology to prevent abuse and ensure its ethical use.
Another example is the use of AI in hiring. If left unchecked, AI algorithms could inadvertently discriminate against certain groups of people, leading to a lack of diversity in the workforce. By implementing AI governance, companies can ensure that their hiring processes are fair and unbiased.
AI governance also helps to prevent the misuse of AI for harmful purposes, such as in the development of autonomous weapons. By implementing guidelines for responsible deployment, governments and organizations can prevent the development of AI systems that harm human life.
https://akash.mittal.blog/Governing-AI-A-Blueprint-for-the-Future-by-Microsoft.html
#trending #AI #ArtificialIntelligence #Governance #Microsoft #Blueprint #Future #ResponsibleAI ","","","linkedin","Akash Mittal","","","","","","2023-05-26-03-46-29-636","https://akash.mittal.blog/Governing-AI-A-Blueprint-for-the-Future-by-Microsoft.html","https://akash.mittal.blog/images/Governing-AI-A-Blueprint-for-the-Future-by-Microsoft.jpeg"
"2023-05-29 05:46 PM;","Remember MySpace? It was the place to be back in the day, with its customizable profiles that let you express your personality and style. But as social media evolved, MySpace fell out of favor and lost its place as the top dog in the digital world.
However, a new browser called Arc is bringing back the MySpace-style customization to the web, and it's gaining traction among tech enthusiasts and social media users alike.
Arc is a Chromium-based browser that allows you to customize your web browsing experience with a variety of themes and color schemes. But unlike MySpace, Arc's customization options go beyond just your profile page. With Arc, you can customize every aspect of your browsing experience, from the toolbar to the background color of the web page itself.
Arc also allows you to create your own themes and share them with others, giving you the ability to express your creativity and connect with other users who share your sense of style.
Since its launch, Arc has gained over 100,000 users, with many praising the browser for its customization options and ease of use. According to the developers of Arc, the browser has also achieved a user satisfaction score of over 90%, with users reporting that they love the ability to personalize their web browsing experience.
https://akash.mittal.blog/Arc-Browser-Brings-MySpace-Style-Customization-to-the-Web.html
#trending #ArcBrowser #ArcBrowser #CustomWebBrowsing #PersonalizedExperience ","","","linkedin","Akash Mittal","","","","","","2023-05-26-03-46-29-636","https://akash.mittal.blog/Arc-Browser-Brings-MySpace-Style-Customization-to-the-Web.html","https://akash.mittal.blog/images/Arc-Browser-Brings-MySpace-Style-Customization-to-the-Web.jpeg"
"2023-05-29 06:46 PM;","In 2022, a large tech company announced that they had implemented a new hiring system, one that used artificial intelligence to analyze resumes and conduct initial interviews. The system was praised for being unbiased and efficient, and was soon adopted by several other companies in the industry.
However, it wasn't long before the flaws in the system became apparent. One woman, who had applied for a position at the tech company, was repeatedly rejected despite having more experience and qualifications than many of her male counterparts. It wasn't until she filed a lawsuit that the company discovered their AI system had been trained on data that reflected implicit biases against women, and that the system itself had begun to perpetuate those biases.
The lawsuit was settled out of court, but it sparked a conversation about the regulation of AI systems in hiring and other areas of business.
The use of artificial intelligence in hiring has become increasingly common in recent years, as companies look for ways to automate and streamline their HR processes. But as the above story illustrates, there are significant risks associated with relying on AI in this way.
AI systems can perpetuate and amplify biases and discrimination that exist in society, often without humans even realizing it. They can also be based on flawed or incomplete data, which can lead to faulty decision-making.
https://akash.mittal.blog/A-Hiring-Law-Blazes-a-Path-for-AI-Regulation.html
#trending #AIregulation #hiringbias #diversityandinclusion #AIethics ","","","Facebook","Dave's Academy","","","","","","2023-05-26-03-46-29-636","https://akash.mittal.blog/A-Hiring-Law-Blazes-a-Path-for-AI-Regulation.html","https://akash.mittal.blog/images/A-Hiring-Law-Blazes-a-Path-for-AI-Regulation.jpeg"
"2023-05-29 06:46 PM;","In 2022, a large tech company announced that they had implemented a new hiring system, one that used artificial intelligence to analyze resumes and conduct initial interviews. The system was praised for being unbiased and efficient, and was soon adopted by several other companies in the industry.
However, it wasn't long before the flaws in the system became apparent. One woman, who had applied for a position at the tech company, was repeatedly rejected despite having more experience and qualifications than many of her male counterparts. It wasn't until she filed a lawsuit that the company discovered their AI system had been trained on data that reflected implicit biases against women, and that the system itself had begun to perpetuate those biases.
The lawsuit was settled out of court, but it sparked a conversation about the regulation of AI systems in hiring and other areas of business.
The use of artificial intelligence in hiring has become increasingly common in recent years, as companies look for ways to automate and streamline their HR processes. But as the above story illustrates, there are significant risks associated with relying on AI in this way.
AI systems can perpetuate and amplify biases and discrimination that exist in society, often without humans even realizing it. They can also be based on flawed or incomplete data, which can lead to faulty decision-making.
https://akash.mittal.blog/A-Hiring-Law-Blazes-a-Path-for-AI-Regulation.html
#trending #AIregulation #hiringbias #diversityandinclusion #AIethics ","","","linkedin","Dave's Academy","","","","","","2023-05-26-03-46-29-636","https://akash.mittal.blog/A-Hiring-Law-Blazes-a-Path-for-AI-Regulation.html","https://akash.mittal.blog/images/A-Hiring-Law-Blazes-a-Path-for-AI-Regulation.jpeg"
"2023-05-29 07:46 PM;","Once upon a time in rural Tennessee, a young girl named Dolly Parton dreamed of becoming a country music superstar. Despite growing up in poverty and living in a one-room cabin with her 11 siblings, her imagination was always her escape and her inspiration. Now, years after she became a household name and Grammy Award-winner, Dolly Parton's Imagination Library continues to inspire and empower children to dream big, learn and grow.
Imagination Library is a free book gifting program that sends age-appropriate books to children from birth to age five. Started by Dolly Parton in 1995, the program has since expanded to all 50 states, the United Kingdom, and Canada. In Indiana, the program will soon be available statewide, thanks to the efforts of early childhood advocates and community leaders.
By launching Dolly Parton's Imagination Library statewide, Indiana is reaffirming its commitment to early childhood development. According to the Indiana Youth Institute, children who have access to books and quality early childhood education are more likely to succeed academically, complete high school, and become productive members of society. Unfortunately, not all children have equal access to these resources, which is where Imagination Library comes in.
Beginning in 2022, Indiana families will be able to sign up for the Imagination Library program at no cost. Each month, a new book will be mailed to their child, helping to build their literacy skills and foster a love of reading from a young age. The program is expected to reach more than 74,000 children across the state, including those in rural and underserved communities.
Imagination Library has already made a significant impact in other states and countries, with measurable outcomes such as:
https://akash.mittal.blog/Indiana-to-Launch-Dolly-Parton-s-Imagination-Library-Statewide.html
#trending #ImaginationLibrary #EarlyChildhoodEducation #ChildLiteracy #top ","","","linkedin","Akash Mittal","","","","","","2023-05-26-03-46-29-636","https://akash.mittal.blog/Indiana-to-Launch-Dolly-Parton-s-Imagination-Library-Statewide.html","https://akash.mittal.blog/images/Indiana-to-Launch-Dolly-Parton-s-Imagination-Library-Statewide.jpeg"
"2023-05-29 08:46 PM;","Once upon a time, there was a little boy named Max. Max was six years old, and he had spent most of his life in foster care. He had been removed from his birth mother's care when he was just a baby, and he had bounced around from one foster home to another ever since. Max was a sweet and loving child, but he struggled with behavioral issues and emotional challenges as a result of his early experiences.
Max's birth mother, Sarah, had worked hard to address the issues in her life that had led to her son being taken away. She had completed parenting classes, gotten a job, and found a stable place to live. She was ready to be reunited with her son, but the process was complicated by the fact that Max had spent so much time in foster care. He had attachments to his foster parents and struggled with the idea of leaving them.
This is where shared parenting came in. Shared parenting is a model of care where birth parents and foster parents work together as a team to support the needs of the child. This includes sharing information, working out visitation schedules, and, in some cases, even living together as a family. By working together, birth parents and foster parents can create a more stable and supportive environment for the child.
In Max's case, shared parenting meant that his foster parents and birth mother were able to build a relationship. Sarah was able to visit Max regularly and attend his school events and activities. She was also able to work with his foster parents to create a plan for his transition back to her care. Max's foster parents were able to provide Sarah with information about his likes and dislikes, his routines, and his behaviors. They were also able to support Max's emotional needs during this time of transition.
Because of shared parenting, Max was able to successfully transition back to his birth mother's care. Sarah's love and commitment to her son, combined with the support of his foster parents, helped Max to feel safe, secure, and loved. He was able to maintain a relationship with his foster parents, who continued to play an important role in his life as mentors and friends.
https://akash.mittal.blog/The-Power-of-Shared-Parenting-Reuniting-a-Little-Boy-in-Foster-Care-with-His-Birth-Mother.html
#trending #SharedParenting #FosterCare #Reunification #FamilyConnections ","","","Facebook","Dave's Academy","","","","","","2023-05-26-03-46-29-636","https://akash.mittal.blog/The-Power-of-Shared-Parenting-Reuniting-a-Little-Boy-in-Foster-Care-with-His-Birth-Mother.html","https://akash.mittal.blog/images/The-Power-of-Shared-Parenting-Reuniting-a-Little-Boy-in-Foster-Care-with-His-Birth-Mother.jpeg"
"2023-05-29 08:46 PM;","Once upon a time, there was a little boy named Max. Max was six years old, and he had spent most of his life in foster care. He had been removed from his birth mother's care when he was just a baby, and he had bounced around from one foster home to another ever since. Max was a sweet and loving child, but he struggled with behavioral issues and emotional challenges as a result of his early experiences.
Max's birth mother, Sarah, had worked hard to address the issues in her life that had led to her son being taken away. She had completed parenting classes, gotten a job, and found a stable place to live. She was ready to be reunited with her son, but the process was complicated by the fact that Max had spent so much time in foster care. He had attachments to his foster parents and struggled with the idea of leaving them.
This is where shared parenting came in. Shared parenting is a model of care where birth parents and foster parents work together as a team to support the needs of the child. This includes sharing information, working out visitation schedules, and, in some cases, even living together as a family. By working together, birth parents and foster parents can create a more stable and supportive environment for the child.
In Max's case, shared parenting meant that his foster parents and birth mother were able to build a relationship. Sarah was able to visit Max regularly and attend his school events and activities. She was also able to work with his foster parents to create a plan for his transition back to her care. Max's foster parents were able to provide Sarah with information about his likes and dislikes, his routines, and his behaviors. They were also able to support Max's emotional needs during this time of transition.
Because of shared parenting, Max was able to successfully transition back to his birth mother's care. Sarah's love and commitment to her son, combined with the support of his foster parents, helped Max to feel safe, secure, and loved. He was able to maintain a relationship with his foster parents, who continued to play an important role in his life as mentors and friends.
https://akash.mittal.blog/The-Power-of-Shared-Parenting-Reuniting-a-Little-Boy-in-Foster-Care-with-His-Birth-Mother.html
#trending #SharedParenting #FosterCare #Reunification #FamilyConnections ","","","linkedin","Dave's Academy","","","","","","2023-05-26-03-46-29-636","https://akash.mittal.blog/The-Power-of-Shared-Parenting-Reuniting-a-Little-Boy-in-Foster-Care-with-His-Birth-Mother.html","https://akash.mittal.blog/images/The-Power-of-Shared-Parenting-Reuniting-a-Little-Boy-in-Foster-Care-with-His-Birth-Mother.jpeg"
"2023-05-29 09:46 PM;","It was 10 PM on a school night and 15-year-old Emily was still glued to her phone, scrolling through her Facebook feed. As her mother walked into the room, she saw Emily's tired eyes and knew that something had to change.
This scenario is becoming increasingly common as teenagers today spend more and more time on social media. As parents, it's our responsibility to guide our children towards responsible use of technology and social media. But, how much of an impact does parenting have on how social media affects our teenagers? Let's take a closer look.
Studies have shown that parents play a crucial role in shaping how their teenagers use social media. According to a report by Common Sense Media, ""parents who set rules and place limits on their child's use of media are more likely to have positive outcomes for their children's media use, including social and emotional well-being."" The report also found that ""parental engagement in children's media use is associated with lower levels of risky media behavior.""
Let's look at some quantifiable examples of the impact of parenting on social media use:
So, how can parents take an active role in shaping their teenager's social media use? Here are some practical tips:
https://akash.mittal.blog/The-Impact-of-Parenting-on-Teenagers-and-Social-Media-A-Comprehensive-Guide.html
#trending #parenting #socialmedia #teenagers #onlinesafety #digitalparenting ","","","Facebook","Dave's Academy","","","","","","2023-05-26-03-46-29-636","https://akash.mittal.blog/The-Impact-of-Parenting-on-Teenagers-and-Social-Media-A-Comprehensive-Guide.html","https://akash.mittal.blog/images/The-Impact-of-Parenting-on-Teenagers-and-Social-Media-A-Comprehensive-Guide.jpeg"
"2023-05-29 09:46 PM;","It was 10 PM on a school night and 15-year-old Emily was still glued to her phone, scrolling through her Facebook feed. As her mother walked into the room, she saw Emily's tired eyes and knew that something had to change.
This scenario is becoming increasingly common as teenagers today spend more and more time on social media. As parents, it's our responsibility to guide our children towards responsible use of technology and social media. But, how much of an impact does parenting have on how social media affects our teenagers? Let's take a closer look.
Studies have shown that parents play a crucial role in shaping how their teenagers use social media. According to a report by Common Sense Media, ""parents who set rules and place limits on their child's use of media are more likely to have positive outcomes for their children's media use, including social and emotional well-being."" The report also found that ""parental engagement in children's media use is associated with lower levels of risky media behavior.""
Let's look at some quantifiable examples of the impact of parenting on social media use:
So, how can parents take an active role in shaping their teenager's social media use? Here are some practical tips:
https://akash.mittal.blog/The-Impact-of-Parenting-on-Teenagers-and-Social-Media-A-Comprehensive-Guide.html
#trending #parenting #socialmedia #teenagers #onlinesafety #digitalparenting ","","","linkedin","Dave's Academy","","","","","","2023-05-26-03-46-29-636","https://akash.mittal.blog/The-Impact-of-Parenting-on-Teenagers-and-Social-Media-A-Comprehensive-Guide.html","https://akash.mittal.blog/images/The-Impact-of-Parenting-on-Teenagers-and-Social-Media-A-Comprehensive-Guide.jpeg"
"2023-05-29 10:46 PM;","By CNN
Microsoft, one of the world's largest technology companies, has called for a new US agency and executive order to regulate the development and deployment of artificial intelligence (AI) technologies. In an announcement last week, Brad Smith, Microsoft's president, stated that AI is one of the most transformative technologies of our time, and it is imperative that we regulate it in a way that ensures safety and privacy.
According to a recent report by the Pew Research Center, nearly 60% of Americans believe that AI will have a negative impact on the way that people live their lives. The report highlights concerns about the potential for AI to take over jobs, invade privacy, and spread propaganda and misinformation. It is clear that there is a growing need for regulations to address these concerns.
Microsoft has already begun to take steps to address some of these concerns. Last year, the company announced the creation of an AI ethics committee to oversee the development and deployment of its AI technologies. The committee is responsible for ensuring that Microsoft's AI systems do not violate ethical principles, such as respect for human dignity, fairness and accountability.
There are also examples where AI has already been regulated. In the European Union, the General Data Protection Regulation (GDPR) provides a framework for the regulation of AI in relation to data protection. The regulation requires companies to obtain explicit user consent before collecting their personal data and gives individuals the right to access and control their personal data.
https://akash.mittal.blog/Microsoft-s-call-for-new-US-agency-and-executive-order-in-AI-regulation-debate-CNN.html
#trending #Microsoft #AIRegulation #EthicsInAI #AIimpact #FacialRecognition #DataPrivacy ","","","linkedin","Akash Mittal","","","","","","2023-05-26-03-46-29-636","https://akash.mittal.blog/Microsoft-s-call-for-new-US-agency-and-executive-order-in-AI-regulation-debate-CNN.html","https://akash.mittal.blog/images/Microsoft-s-call-for-new-US-agency-and-executive-order-in-AI-regulation-debate-CNN.jpeg"
