"2023-06-01 02:07 AM;","Marvell Technology is a leading provider of data infrastructure solutions that help customers accelerate their digital transformation. The company has been around since 1995, but it wasn't until recently that it has gained significant attention in the AI industry.
Marvell has been making strategic moves to position itself as a key player in the AI space. For example, the company has been investing heavily in R&D, acquiring companies like Cavium and Avera Semiconductor, and partnering with other industry leaders like Arm and Microsoft.
All of these efforts have been paying off, as Marvell has seen explosive growth in its AI narrative. According to data from Google Trends, interest in Marvell's AI capabilities has skyrocketed in the past year.
Here are some quantifiable examples of Marvell's explosive surge on AI narrative:
All of these metrics point to a clear trend - Marvell has become a major player in the AI industry.
https://akash.mittal.blog/The-Explosive-Surge-of-Marvell-Technology-on-AI-Narrative-A-Quantifiable-Analysis.html
#trending #MarvellTechnology #AI #Narrative #QuantifiableAnalysis ","","","linkedin","Akash Mittal","","","","","","2023-05-28-01-07-29-989","https://akash.mittal.blog/The-Explosive-Surge-of-Marvell-Technology-on-AI-Narrative-A-Quantifiable-Analysis.html","https://akash.mittal.blog/images/The-Explosive-Surge-of-Marvell-Technology-on-AI-Narrative-A-Quantifiable-Analysis.jpeg"
"2023-06-01 03:07 AM;","It was a beautiful day for baseball at the Onondaga Community College baseball field as Cazenovia High School took on Westhill in the sectional Class B semifinal. Fans from both sides filled the stands, eagerly cheering on their teams. The energy was palpable, and the players could feel it.
From the very start, Cazenovia was in control. Their offense was firing on all cylinders, and their defense was rock solid. Westhill tried to mount a comeback, but Cazenovia's pitching was too dominant, striking out batter after batter. By the time the final out was recorded, the score stood at 10-2 in favor of Cazenovia.
The victory was not just a matter of scoreboard, but it is a result of the hard work and dedication of the Cazenovia baseball team. Here are some quantifiable examples:
There were many factors that contributed to Cazenovia's victory, but here are three that stood out:
The victory against Westhill was a team effort, and it was a testament to the hard work and dedication of the Cazenovia baseball program. The players executed their game plan to perfection, and they showed great poise and confidence under pressure. Here are three takeaways from the game:
https://akash.mittal.blog/Cazenovia-Baseball-Routs-Westhill-in-Sectional-Class-B-Semifinal.html
#trending #CazenoviaBaseball #SectionalClassB #Victory #BaseballChampions #Sports #News #CazenoviaBaseball #SectionalClassB #Victory #BaseballChampions #Sports #News ","","","linkedin","Akash Mittal","","","","","","2023-05-28-01-07-29-989","https://akash.mittal.blog/Cazenovia-Baseball-Routs-Westhill-in-Sectional-Class-B-Semifinal.html","https://akash.mittal.blog/images/Cazenovia-Baseball-Routs-Westhill-in-Sectional-Class-B-Semifinal.jpeg"
"2023-06-01 04:07 AM;","It's hard to believe that a plain white t-shirt could be the subject of a major marketing campaign. But that's exactly what's happening in the world of retail.
Retailers have long struggled to find ways to market their basic products, such as the plain white t-shirt. These items aren't particularly interesting or unique, which makes it difficult to create a compelling marketing message around them.
But with the advent of artificial intelligence (AI), retailers are finding new ways to market their products and create a personalized shopping experience for customers.
In this article, we'll explore how AI is being used to revolutionize the world of retail, from the plain white t-shirt to personalized fashion.
One of the key benefits of using AI in retail marketing is the ability to collect and analyze vast amounts of data on customer preferences and shopping behavior.
https://akash.mittal.blog/How-AI-is-revolutionizing-retail-From-the-plain-white-t-shirt-to-personalized-fashion.html
#trending #story #examples #tips #conclusion #AIretail #personalizedshopping #AIinretailmarketing ","","","linkedin","Akash Mittal","","","","","","2023-05-28-01-07-29-989","https://akash.mittal.blog/How-AI-is-revolutionizing-retail-From-the-plain-white-t-shirt-to-personalized-fashion.html","https://akash.mittal.blog/images/How-AI-is-revolutionizing-retail-From-the-plain-white-t-shirt-to-personalized-fashion.jpeg"
"2023-06-01 05:07 AM;","By Parenting expert Justin Coulson
Have you ever felt like you're not making progress towards your romantic goals? For me, online dating felt like throwing spaghetti at a wall, hoping something would stick. I'd spend hours swiping and messaging, but it felt like I was getting nowhere. That's when I decided to try something different - a spreadsheet.
Before you roll your eyes, hear me out. I'm all for spontaneity and chemistry, but when it wasn't working for me, I needed a new approach. I created a simple spreadsheet to track my online dating activity. It was nothing fancy, just a few columns to help me keep track of who I'd contacted and when. I also added a notes section where I could jot down specific details about their profile or our conversation.
At first, it felt a bit clinical. But once I got into the groove of tracking my activity, something unexpected happened. I started noticing patterns. I saw which messages resulted in responses. I saw which profiles grabbed my attention. I saw which dates led to second dates. Suddenly, I had quantitative data to work with, instead of just my gut feelings.
Here are some examples of how my spreadsheet helped me:
https://akash.mittal.blog/How-a-Spreadsheet-Helped-Me-Find-Love.html
#trending #love #onlinedating #spreadsheets #datingsuccess #datingtips ","","","Facebook","Dave's Academy","","","","","","2023-05-28-01-07-29-989","https://akash.mittal.blog/How-a-Spreadsheet-Helped-Me-Find-Love.html","https://akash.mittal.blog/images/How-a-Spreadsheet-Helped-Me-Find-Love.jpeg"
"2023-06-01 05:07 AM;","By Parenting expert Justin Coulson
Have you ever felt like you're not making progress towards your romantic goals? For me, online dating felt like throwing spaghetti at a wall, hoping something would stick. I'd spend hours swiping and messaging, but it felt like I was getting nowhere. That's when I decided to try something different - a spreadsheet.
Before you roll your eyes, hear me out. I'm all for spontaneity and chemistry, but when it wasn't working for me, I needed a new approach. I created a simple spreadsheet to track my online dating activity. It was nothing fancy, just a few columns to help me keep track of who I'd contacted and when. I also added a notes section where I could jot down specific details about their profile or our conversation.
At first, it felt a bit clinical. But once I got into the groove of tracking my activity, something unexpected happened. I started noticing patterns. I saw which messages resulted in responses. I saw which profiles grabbed my attention. I saw which dates led to second dates. Suddenly, I had quantitative data to work with, instead of just my gut feelings.
Here are some examples of how my spreadsheet helped me:
https://akash.mittal.blog/How-a-Spreadsheet-Helped-Me-Find-Love.html
#trending #love #onlinedating #spreadsheets #datingsuccess #datingtips ","","","linkedin","Dave's Academy","","","","","","2023-05-28-01-07-29-989","https://akash.mittal.blog/How-a-Spreadsheet-Helped-Me-Find-Love.html","https://akash.mittal.blog/images/How-a-Spreadsheet-Helped-Me-Find-Love.jpeg"
"2023-06-01 06:07 AM;","Have you ever heard of ChatGPT? It's one of the hottest new trends in artificial intelligence, boasting an impressively human-like ability to generate text. However, what many people don't know is that ChatGPT, and other forms of generative AI, have a significant impact on the environment.
Before we dive into the specifics of ChatGPT's environmental impact, let's take a moment to discuss carbon footprints. A carbon footprint is the amount of carbon dioxide and other greenhouse gases emitted into the atmosphere as a result of our activities. These emissions are a major contributor to climate change, which poses a significant threat to our planet and its inhabitants.
Calculating a carbon footprint can be a complex process, but it typically involves assessing the amount of carbon emissions generated by various activities and multiplying that by a particular factor to arrive at a total. For example, driving a car for one hour might produce 5 kilograms of carbon dioxide (CO2), and the average person might do that five times per week. That would translate to a total of 1,300 kilograms of CO2 emissions per year just from driving alone.
So, how does this relate to ChatGPT and other forms of generative AI? In short, these technologies require a lot of computational power, and that power comes from machines that consume energy and emit greenhouse gases.
So, just how big of an impact does ChatGPT have on the environment? According to a recent study, training a single instance of ChatGPT with a standard configuration can produce up to 626kg of CO2 emissions. That's equivalent to driving a car for 2,796km!
https://akash.mittal.blog/Is-ChatGPT-Bad-for-the-Environment-A-Look-at-Generative-AI-s-Carbon-Footprint.html
#trending #ChatGPT #generativeAI #carbonfootprint #environment #sustainability ","","","linkedin","Akash Mittal","","","","","","2023-05-28-01-07-29-989","https://akash.mittal.blog/Is-ChatGPT-Bad-for-the-Environment-A-Look-at-Generative-AI-s-Carbon-Footprint.html","https://akash.mittal.blog/images/Is-ChatGPT-Bad-for-the-Environment-A-Look-at-Generative-AI-s-Carbon-Footprint.jpeg"
"2023-06-01 07:07 AM;","It's a common trope in science fiction movies and TV shows: robots and AI systems taking care of all the household chores so that humans can focus on more important things. However, in reality, artificial intelligence still has a long way to go in terms of automating even the simplest of tasks, like taking out the trash.
Several years ago, a tech startup called GeniCan launched a product called the ""smart trash can."" The idea was simple: the trash can would have a built-in barcode scanner and voice recognition software, allowing users to easily scan items as they threw them away and automatically add them to their shopping list. Sounds convenient, right?
However, the product didn't exactly take off. Reviews were mixed, with some users reporting that the barcode scanner didn't work properly and others complaining that the voice recognition software couldn't understand them. Plus, the trash can was pretty expensive compared to a regular one.
While the smart trash can is an example of AI being used to automate a household task, it shows that we still have a long way to go in terms of making these systems reliable, user-friendly, and cost-effective.
Here are some other examples that demonstrate the limitations of AI when it comes to household tasks:
https://akash.mittal.blog/AI-Still-Struggles-to-Take-Out-the-Trash.html
#trending #AI #automation #householdtasks #trash #wastemanagement ","","","linkedin","Akash Mittal","","","","","","2023-05-28-01-07-29-989","https://akash.mittal.blog/AI-Still-Struggles-to-Take-Out-the-Trash.html","https://akash.mittal.blog/images/AI-Still-Struggles-to-Take-Out-the-Trash.jpeg"
"2023-06-01 08:07 AM;","It was a humid day in Beijing when the Chinese government released its long-awaited white paper on Web3, the next generation of the internet. As the CEO of Binance, the largest cryptocurrency exchange in the world, I couldn't help but feel both excited and anxious. Excited because Web3 promised to revolutionize the way we interact online, and anxious because the white paper came amid a crackdown on crypto trading and mining in China.

China has a complicated relationship with cryptocurrency. On one hand, the government has long been fascinated with blockchain technology, and even launched its own digital currency, the digital yuan, in 2020. On the other hand, it has been equally wary of the decentralized and borderless nature of cryptocurrencies, which it sees as a threat to its centralized control.
https://akash.mittal.blog/The-Rise-and-Fall-of-Cryptocurrency-in-China-A-Story-of-Web3-White-Paper-and-Hong-Kong-Crypto.html
#trending #Web3 #Cryptocurrency #China #Blockchain #Bitcoin #Binance ","","","linkedin","Akash Mittal","","","","","","2023-05-28-01-07-29-989","https://akash.mittal.blog/The-Rise-and-Fall-of-Cryptocurrency-in-China-A-Story-of-Web3-White-Paper-and-Hong-Kong-Crypto.html","https://akash.mittal.blog/images/The-Rise-and-Fall-of-Cryptocurrency-in-China-A-Story-of-Web3-White-Paper-and-Hong-Kong-Crypto.jpeg"
"2023-06-01 09:07 AM;","There was a time when a law degree was all a lawyer needed to be successful. However, in today's technological age, the use of Artificial Intelligence (AI) has become increasingly popular in legal research. More and more firms are embracing the technology as a way of increasing efficiency, reducing costs and gaining a competitive edge over their competitors.
This is the story of a US lawyer who boldly admitted to using AI for case research and has since witnessed a transformation in the legal profession. The lawyer, whose name will not be disclosed for confidentiality purposes, started experimenting with AI technology early in his career. He was driven by the need to provide better services to his clients and to stay ahead of the game.
""When I first started using AI, it was mostly out of curiosity. At the time, I was struggling to keep up with the rate at which new cases were coming in,"" the lawyer said.
He went on to explain that he found himself spending long hours poring over legal jurisprudence and law journals, trying to find relevant material for his cases. He added that it was an immensely time-consuming process, which often left him exhausted and burnt out.
""I felt like I was stuck in a rut, with no way to move forward in my career. That's when I decided to try something new and explore the world of AI. It was a life-changing decision."" he confessed.
https://akash.mittal.blog/The-Rise-of-AI-in-the-Legal-Industry-A-Game-Changer-or-A-Threat-to-Lawyers.html
#trending #AI #LegalIndustry #Digitization #LegalResearch #Competition #Efficiency #Advantages #Disadvantages #FutureTrends #Lawyers #Technology #Costs #Accessiblitiy #ContractsManagement #PublicSafety #LegalResearch #Analytics ","","","linkedin","Akash Mittal","","","","","","2023-05-28-01-07-29-989","https://akash.mittal.blog/The-Rise-of-AI-in-the-Legal-Industry-A-Game-Changer-or-A-Threat-to-Lawyers.html","https://akash.mittal.blog/images/The-Rise-of-AI-in-the-Legal-Industry-A-Game-Changer-or-A-Threat-to-Lawyers.jpeg"
"2023-06-01 10:07 AM;","By TechCrunch
It was an ordinary day. I was using my smartphone to order groceries when I noticed an unusual prompt. The app had started suggesting items I hadn't even thought of buying. ""Did you forget something?"" it asked. I scrolled down to see that it had added a few extra items to my cart, items that it thought I might need based on my previous purchases and browsing history.
At first, I was impressed by the app's foresight. But then it hit me: this was artificial intelligence at work. The app had studied my habits, preferences, and tendencies and analyzed them to predict what I might need next. It knew me better than I knew myself. That's when the fear set in.
AI scares the bejesus out of me. And I'm not alone.
It's one thing to worry about AI in the context of sci-fi movies like The Terminator, where robots take over the world and enslave humans. But it's another to see its real-world impacts.
https://akash.mittal.blog/Why-AI-Scares-The-Bejesus-Out-Of-Me.html
#trending #artificialintelligence #AI #scaryfuture #technology #robots ","","","linkedin","Akash Mittal","","","","","","2023-05-28-01-07-29-989","https://akash.mittal.blog/Why-AI-Scares-The-Bejesus-Out-Of-Me.html","https://akash.mittal.blog/images/Why-AI-Scares-The-Bejesus-Out-Of-Me.jpeg"
"2023-06-01 11:07 AM;","Social media has been buzzing with a strange and surreal video clip featuring Florida Governor Ron DeSantis. The nearly two-minute video was tweeted by Donald Trump Jr, son of former President Donald Trump, on June 15, and quickly went viral. In the video, a computer-generated version of DeSantis walks into an office and begins performing some odd dance moves while background music plays. The AI-generated Governor then tosses a football to Donald Trump Jr. While the video may seem humorous at first glance, it has raised some serious concerns about the use of AI-generated content, especially in the political realm.

The video clip is just the latest example of how AI technology has reached new heights. It is now possible for computer programs to generate convincing images, audio, and video content that can trick and deceive people. In recent years, there have been several high-profile cases of deepfake videos, where audio or video footage is manipulated to make it appear as if someone is saying or doing something they did not. These types of videos can be used to spread false information for political or personal gain and create distrust and division among people.
https://akash.mittal.blog/Bizarre-AI-Clip-of-Ron-DeSantis-is-the-Talk-of-the-Town.html
#trending #AIgeneratedcontent #RonDeSantis #DonaldTrumpJr #deepfakes #politics #regulatingAI #ethics #malicioususe ","","","linkedin","Akash Mittal","","","","","","2023-05-28-01-07-29-989","https://akash.mittal.blog/Bizarre-AI-Clip-of-Ron-DeSantis-is-the-Talk-of-the-Town.html","https://akash.mittal.blog/images/Bizarre-AI-Clip-of-Ron-DeSantis-is-the-Talk-of-the-Town.jpeg"
"2023-06-01 12:07 PM;","When Jessa received a message from someone claiming to be her long lost friend on the ChatGPT messaging app, she was overjoyed. They chatted for hours, reminiscing about their school days and catching up on each other's lives.
But when Jessa's friend asked her to invest in a ""revolutionary new cryptocurrency"" that ChatGPT was launching, she became suspicious. She did some research and discovered that her friend's account had been hacked and someone was using it to promote a fake investment scheme.
Jessa was lucky to discover the scam before she lost any money, but not everyone is so fortunate. ChatGPT scams have become increasingly common in recent years, as scammers exploit the app's popularity and ease of use to dupe unsuspecting users out of their money.
ChatGPT scams come in many different forms, but some of the most common include:
Fortunately, there are steps you can take to protect yourself from ChatGPT scams:
https://akash.mittal.blog/Mitigating-the-Risks-of-ChatGPT-Themed-Scams.html
#trending #ChatGPTScams #OnlineScams #CyberSecurity ","","","linkedin","Akash Mittal","","","","","","2023-05-28-01-07-29-989","https://akash.mittal.blog/Mitigating-the-Risks-of-ChatGPT-Themed-Scams.html","https://akash.mittal.blog/images/Mitigating-the-Risks-of-ChatGPT-Themed-Scams.jpeg"
"2023-06-01 01:07 PM;","by Your Name Here
Imagine you woke up one day to find out that all of the writers, musicians and graphic designers had been replaced by machines. That may sound like a sci-fi movie, but it could soon be a reality in this age of generative AI. In the last few years, we have seen a significant rise in this technology and the impact it can have on various sectors of business.
The use of generative AI has increased tremendously in recent times, making it easier for businesses to carry out their operations. Generative AI has become a part of numerous products, services, and processes. It is because of this that many businesses have started to investigate how it could benefit their operations.
The generative AI boom is projected to create $3.9 trillion by 2022, with the greatest share in healthcare, automotive, and financial services. It is estimated that it could reduce costs by 60% and increase efficiency by 40%, leading to a potential increase of up to 20% in productivity.
One example of generative AI at work is in the gaming industry. Game developers using generative AI to create digital characters that are lifelike, believable and unique. Another example is in the field of automated content creation. Forbes Magazine has used a sophisticated natural language processing tool to create content that reads like it was written by a human.
https://akash.mittal.blog/The-Generative-AI-Boom-Delivering-a-Wave-of-Successful-Businesses.html
#trending #GenerativeAI #SuccessfulBusinesses #VentureBeat #AI #Business ","","","linkedin","Akash Mittal","","","","","","2023-05-28-01-07-29-989","https://akash.mittal.blog/The-Generative-AI-Boom-Delivering-a-Wave-of-Successful-Businesses.html","https://akash.mittal.blog/images/The-Generative-AI-Boom-Delivering-a-Wave-of-Successful-Businesses.jpeg"
"2023-05-31 04:35 AM;","When my son turned 11, I thought I was prepared for whatever challenges parenting a tween would bring. I had read all the books, talked to the experts, and had a game plan in place. But no amount of preparation could have fully prepared me for the rollercoaster ride that is parenting a tween.
One day everything is going smoothly, and the next it feels like you're walking on eggshells. It can be exhausting and frustrating. But it can also be incredibly rewarding. Watching your child grow into their own person, with their own thoughts and opinions, is a beautiful thing to witness.
One of the biggest challenges of parenting a tween is dealing with their mood swings. One minute they're singing and dancing, and the next they're slamming doors and crying. According to a survey by Common Sense Media, 78% of parents say that managing their child's emotions is the most challenging part of parenting a tween.
Another challenge is screen time. According to a study by Pew Research Center, 95% of teens have access to a smartphone, and 45% say they are online almost constantly. That's a lot of screen time, and it can be tough for parents to know how to regulate it.
So how can parents navigate these challenges? Here are three practical tips:
https://akash.mittal.blog/The-Parent-Squad-with-Jenny-Hale-Parenting-a-Tween.html
#trending #parenting #tweens #parentingtips #JennyHale ","","","Facebook","Dave's Academy","","","","","","2023-05-28-02-35-29-786","https://akash.mittal.blog/The-Parent-Squad-with-Jenny-Hale-Parenting-a-Tween.html","https://akash.mittal.blog/images/The-Parent-Squad-with-Jenny-Hale-Parenting-a-Tween.jpeg"
"2023-05-31 04:35 AM;","When my son turned 11, I thought I was prepared for whatever challenges parenting a tween would bring. I had read all the books, talked to the experts, and had a game plan in place. But no amount of preparation could have fully prepared me for the rollercoaster ride that is parenting a tween.
One day everything is going smoothly, and the next it feels like you're walking on eggshells. It can be exhausting and frustrating. But it can also be incredibly rewarding. Watching your child grow into their own person, with their own thoughts and opinions, is a beautiful thing to witness.
One of the biggest challenges of parenting a tween is dealing with their mood swings. One minute they're singing and dancing, and the next they're slamming doors and crying. According to a survey by Common Sense Media, 78% of parents say that managing their child's emotions is the most challenging part of parenting a tween.
Another challenge is screen time. According to a study by Pew Research Center, 95% of teens have access to a smartphone, and 45% say they are online almost constantly. That's a lot of screen time, and it can be tough for parents to know how to regulate it.
So how can parents navigate these challenges? Here are three practical tips:
https://akash.mittal.blog/The-Parent-Squad-with-Jenny-Hale-Parenting-a-Tween.html
#trending #parenting #tweens #parentingtips #JennyHale ","","","linkedin","Dave's Academy","","","","","","2023-05-28-02-35-29-786","https://akash.mittal.blog/The-Parent-Squad-with-Jenny-Hale-Parenting-a-Tween.html","https://akash.mittal.blog/images/The-Parent-Squad-with-Jenny-Hale-Parenting-a-Tween.jpeg"
