"2023-05-31 03:07 PM;","It's hard to imagine life without Google. It has revolutionized the way we search for information, making it easy to find answers to our most pressing questions with just a few clicks. However, in recent years, there has been growing criticism of Google's AI-powered search, with some experts likening it to a ""content farm on steroids.""
A content farm is a website that churns out low-quality, SEO-optimized content in large volumes, with the sole purpose of attracting traffic and generating ad revenue. These websites often use keyword stuffing and other shady SEO tactics to rank high in search engine results pages (SERPs), despite providing little value to readers. They are generally viewed as a scourge on the internet, by both users and legitimate publishers alike.
Google's search algorithm has always been a closely guarded secret, but in recent years, the company has been increasingly open about its use of artificial intelligence (AI) to deliver search results. While AI has undoubtedly improved the speed and relevance of Google's search results, it has also had unintended consequences.
One unintended consequence of Google's AI-powered search is that it has made it easier for content farms to prosper. By analyzing user behavior and preferences, Google's AI is able to identify and rank content that is most likely to satisfy a user's search query. However, this also means that it is more likely to rank low-quality content that is designed to manipulate search engines, rather than provide valuable information to users.
A search for ""How to lose weight fast"" returns over 3 billion results on Google. Most of these results are from content farms that provide generic advice like ""Eat fewer calories"" and ""Exercise more."" While this information is technically correct, it provides little value to users who are looking for more personalized and helpful tips.
https://akash.mittal.blog/Google-s-AI-Search-Feels-Like-a-Content-Farm-on-Steroids.html
#trending #1 #2 #3 #close #GoogleAI #ContentFarm #SEO #FakeNews #DiversityOfOpinion ","","","linkedin","Akash Mittal","","","","","","2023-05-28-01-07-29-989","https://akash.mittal.blog/Google-s-AI-Search-Feels-Like-a-Content-Farm-on-Steroids.html","https://akash.mittal.blog/images/Google-s-AI-Search-Feels-Like-a-Content-Farm-on-Steroids.jpeg"
"2023-05-31 04:07 PM;","Have you ever caught yourself mimicking your child's actions or words? You're not alone! A mom on social media has gained popularity by recreating all the amusing things her toddler does.
Meet Sarah, a young mother of a two-year-old daughter. One day, Sarah was playing with her daughter when she started to imitate her child's behavior when she was pretending she was cooking. The toddler was using a toy kitchen and making all sorts of sounds to mimic the cooking process. Sarah found herself copying the same actions and sounds. The toddler laughed out loud and was surprised to see her mom doing exactly what she was doing. Sarah thought it was hilarious and decided to share it with her friends on social media.
Little did she know that her video would get more than a million views overnight. People loved the idea of parents participating in their children's imaginary world. Sarah started to share more and more reenactments of her child's actions and words. She made videos of her pretending to brush her teeth with her child, dancing silly dances, or just sitting down and pretending she was drinking tea with her child's toys.
Now, Sarah has a huge following on social media, with people from all over the world waiting for her next video. She has even appeared on television shows and has been interviewed for magazines. Sarah thinks that it is important for parents to have fun with their children and to enjoy the small moments in life. By reenacting the amusing things her toddler does, she feels like she is reliving her own childhood all over again.
The popularity of Sarah's reenactments is proof that parents love to connect with their children on a deeper level. In fact, studies have shown that participating in child-led play has many benefits. Here are some quantifiable examples:
https://akash.mittal.blog/She-s-Reenacting-All-Of-The-Amusing-Things-Her-Toddler-Does.html
#trending #reenactment #toddlerlife #bondingwithkids #childledplay ","","","Facebook","Dave's Academy","","","","","","2023-05-28-01-07-29-989","https://akash.mittal.blog/She-s-Reenacting-All-Of-The-Amusing-Things-Her-Toddler-Does.html","https://akash.mittal.blog/images/She-s-Reenacting-All-Of-The-Amusing-Things-Her-Toddler-Does.jpeg"
"2023-05-31 04:07 PM;","Have you ever caught yourself mimicking your child's actions or words? You're not alone! A mom on social media has gained popularity by recreating all the amusing things her toddler does.
Meet Sarah, a young mother of a two-year-old daughter. One day, Sarah was playing with her daughter when she started to imitate her child's behavior when she was pretending she was cooking. The toddler was using a toy kitchen and making all sorts of sounds to mimic the cooking process. Sarah found herself copying the same actions and sounds. The toddler laughed out loud and was surprised to see her mom doing exactly what she was doing. Sarah thought it was hilarious and decided to share it with her friends on social media.
Little did she know that her video would get more than a million views overnight. People loved the idea of parents participating in their children's imaginary world. Sarah started to share more and more reenactments of her child's actions and words. She made videos of her pretending to brush her teeth with her child, dancing silly dances, or just sitting down and pretending she was drinking tea with her child's toys.
Now, Sarah has a huge following on social media, with people from all over the world waiting for her next video. She has even appeared on television shows and has been interviewed for magazines. Sarah thinks that it is important for parents to have fun with their children and to enjoy the small moments in life. By reenacting the amusing things her toddler does, she feels like she is reliving her own childhood all over again.
The popularity of Sarah's reenactments is proof that parents love to connect with their children on a deeper level. In fact, studies have shown that participating in child-led play has many benefits. Here are some quantifiable examples:
https://akash.mittal.blog/She-s-Reenacting-All-Of-The-Amusing-Things-Her-Toddler-Does.html
#trending #reenactment #toddlerlife #bondingwithkids #childledplay ","","","linkedin","Dave's Academy","","","","","","2023-05-28-01-07-29-989","https://akash.mittal.blog/She-s-Reenacting-All-Of-The-Amusing-Things-Her-Toddler-Does.html","https://akash.mittal.blog/images/She-s-Reenacting-All-Of-The-Amusing-Things-Her-Toddler-Does.jpeg"
"2023-05-31 05:07 PM;","Chris Brown has been no stranger to controversy throughout his career. However, one aspect of his life that has caused a lot of scrutiny is his relationships with his baby mamas. Brown has had two children by two different women, and his relationships with each of them couldn't be more different. From social media feuds to custody battles, Brown's relationships with his baby mamas have been anything but quiet.
So, what set these two relationships apart? Why is Brown's relationship with one baby mama relatively peaceful while he has had numerous public disputes with the other? Let's explore.
The first baby mama in the picture is Nia Guzman, who is the mother of Brown's daughter, Royalty. This relationship has been tumultuous from the start. Guzman and Brown have had multiple public disputes over social media, with Guzman accusing Brown of being a bad father and Brown accusing Guzman of using their daughter as a pawn in their custody battle.
On the other hand, Brown's relationship with his second baby mama, Ammika Harris, has been relatively peaceful. While the couple was initially not very public about their relationship, it is now public knowledge that they have a son together. Harris has not been one to engage in public disputes with Brown, and the two seem to be co-parenting their son relatively peacefully.
These two relationships couldn't be more different. While Brown has accused Guzman of using their daughter as a pawn in their custody battle, he has not made similar accusations about Harris. In fact, Harris has publicly supported Brown in the past, and the couple seems to have a positive relationship.
https://akash.mittal.blog/Chris-Brown-s-Relationship-with-Each-of-His-Baby-Mamas-is-Completely-Different.html
#trending #ChrisBrown #BabyMamas #CoParenting #Communication #Respect #Compromise ","","","Facebook","Dave's Academy","","","","","","2023-05-28-01-07-29-989","https://akash.mittal.blog/Chris-Brown-s-Relationship-with-Each-of-His-Baby-Mamas-is-Completely-Different.html","https://akash.mittal.blog/images/Chris-Brown-s-Relationship-with-Each-of-His-Baby-Mamas-is-Completely-Different.jpeg"
"2023-05-31 05:07 PM;","Chris Brown has been no stranger to controversy throughout his career. However, one aspect of his life that has caused a lot of scrutiny is his relationships with his baby mamas. Brown has had two children by two different women, and his relationships with each of them couldn't be more different. From social media feuds to custody battles, Brown's relationships with his baby mamas have been anything but quiet.
So, what set these two relationships apart? Why is Brown's relationship with one baby mama relatively peaceful while he has had numerous public disputes with the other? Let's explore.
The first baby mama in the picture is Nia Guzman, who is the mother of Brown's daughter, Royalty. This relationship has been tumultuous from the start. Guzman and Brown have had multiple public disputes over social media, with Guzman accusing Brown of being a bad father and Brown accusing Guzman of using their daughter as a pawn in their custody battle.
On the other hand, Brown's relationship with his second baby mama, Ammika Harris, has been relatively peaceful. While the couple was initially not very public about their relationship, it is now public knowledge that they have a son together. Harris has not been one to engage in public disputes with Brown, and the two seem to be co-parenting their son relatively peacefully.
These two relationships couldn't be more different. While Brown has accused Guzman of using their daughter as a pawn in their custody battle, he has not made similar accusations about Harris. In fact, Harris has publicly supported Brown in the past, and the couple seems to have a positive relationship.
https://akash.mittal.blog/Chris-Brown-s-Relationship-with-Each-of-His-Baby-Mamas-is-Completely-Different.html
#trending #ChrisBrown #BabyMamas #CoParenting #Communication #Respect #Compromise ","","","linkedin","Dave's Academy","","","","","","2023-05-28-01-07-29-989","https://akash.mittal.blog/Chris-Brown-s-Relationship-with-Each-of-His-Baby-Mamas-is-Completely-Different.html","https://akash.mittal.blog/images/Chris-Brown-s-Relationship-with-Each-of-His-Baby-Mamas-is-Completely-Different.jpeg"
"2023-05-31 06:07 PM;","It's 5:00 PM and you're getting ready to leave work. You're tired and hungry and can't wait to get home. As you're shutting down your computer, you get a notification from your boss. There's a report that needs to be finished by tomorrow morning. You groan and reluctantly turn your computer back on.
But what if there was a way to automate that report? What if you could simply tell your computer what you need and it would produce the report for you? That's the promise of artificial intelligence (AI) – to take care of the mundane tasks that consume our time and energy.
My sister runs a small business selling handmade jewelry. She used to spend hours manually tracking inventory and sales. But after implementing an AI system, the process has become automated. She no longer has to spend time inputting data, and can instead focus on designing and creating new pieces.
A hotel in Japan uses an AI system to check in and check out guests, as well as provide recommendations for local restaurants and attractions. This has allowed their staff to focus on more personalized interactions with guests, leading to higher guest satisfaction ratings.
As AI continues to evolve, it will become increasingly integrated into our daily lives. Its rise may not be apocalyptic, but it will certainly change the way we work and live. It's up to us to embrace it and use it to our advantage.
https://akash.mittal.blog/AI-The-Mundane-Rise.html
#trending #AI #MundaneRise #ArtificialIntelligence #AI #MundaneRise #ArtificialIntelligence ","","","linkedin","Akash Mittal","","","","","","2023-05-28-01-07-29-989","https://akash.mittal.blog/AI-The-Mundane-Rise.html","https://akash.mittal.blog/images/AI-The-Mundane-Rise.jpeg"
"2023-05-31 07:07 PM;","On a bright summer day, a young lawyer enthusiastically walked into the courthouse to argue his first case. He was confident, prepared, and eager to make a name for himself. Little did he know, that day would mark the beginning of a downward spiral that would not only tarnish his reputation but also would leave a permanent stain on the legal profession.
The lawyer, whose identity was never publicly disclosed, started to fabricate court citations to bolster his arguments in various cases. He thought that using citations from fictitious cases would make him appear more knowledgeable and impressive in front of his clients and the judges. He thought that no one would notice his little deception and that it would be his little secret.
But like any lie, it eventually caught up with him. His colleagues noticed inconsistencies in his arguments, and the judges became suspicious of the citations he used in his briefs. One day, after a particularly egregious instance of citation falsification, the lawyer was called to the disciplinary committee of the bar association.
It was a moment of reckoning for him. He realized the gravity of his mistake and the impact it had on the legal profession's credibility. He had violated the ethical rules governing lawyers, and the trust his clients and colleagues had placed in him was shattered.
After a long and painful process, the lawyer finally apologized for his actions. He recognized his mistake and promised to never repeat it. He hoped that his apology would serve as a cautionary tale for other young lawyers who might be tempted to take shortcuts to success.
https://akash.mittal.blog/The-Apology-of-a-Lawyer-A-Cautionary-Tale.html
#trending #LawyerApology #EthicalLegalPractice #LegalMistakes #ProfessionalConduct #LawyerApology #EthicalLegalPractice #LegalMistakes #ProfessionalConduct ","","","linkedin","Akash Mittal","","","","","","2023-05-28-01-07-29-989","https://akash.mittal.blog/The-Apology-of-a-Lawyer-A-Cautionary-Tale.html","https://akash.mittal.blog/images/The-Apology-of-a-Lawyer-A-Cautionary-Tale.jpeg"
"2023-05-31 08:07 PM;","Imagine a world where freelancers can connect with clients from all around the globe in a virtual metaverse, where they can collaborate, communicate and complete projects in an immersive environment. This might sound like something out of a science fiction movie, but it is now a reality thanks to DeeLance.
DeeLance is a platform that leverages the power of Web3 technology to create a freelancing metaverse, where freelancers and clients can engage in a decentralized ecosystem secure and efficient. Its unique business model allows for users to access a wide range of high-quality services from around the world while maintaining control over their assets and data.
Recently, DeeLance made headlines by securing a huge $1.12 million in seed funding. This landmark investment will allow the platform to grow even further, opening up new possibilities for the freelancing metaverse and changing the economics of work forever.
What sets DeeLance apart from traditional freelancing platforms is its innovative use of Web3 technology, particularly the use of digital wallets, smart contracts and NFTs for work and payment. This effectively eliminates the need for intermediaries and empowers freelancers by giving them full control over their pay and intellectual property.
The Future of Freelancing: Inside DeeLance's Web3 Metaverse
https://akash.mittal.blog/First-of-its-kind-Web3-Freelancing-Metaverse-DeeLance-Secures-Huge-1-12-Million.html
#trending ","","","linkedin","Akash Mittal","","","","","","2023-05-28-01-07-29-989","https://akash.mittal.blog/First-of-its-kind-Web3-Freelancing-Metaverse-DeeLance-Secures-Huge-1-12-Million.html","https://akash.mittal.blog/images/First-of-its-kind-Web3-Freelancing-Metaverse-DeeLance-Secures-Huge-1-12-Million.jpeg"
"2023-05-31 09:07 PM;","By TechRadar
Recently, a group of hackers has found a way to exploit the online chatbot service, ChatGPT, to infiltrate and damage computer systems. ChatGPT, which is powered by artificial intelligence and natural language processing, has been a fun and harmless way for people to pass the time by chatting with a virtual conversationalist. However, it has now become a dangerous tool for cybercriminals to gain access to passwords, sensitive data, and even corporate networks.
It all started when a cyber espionage group discovered that ChatGPT could be manipulated by malicious code. They were able to inject customized scripts that could access systems and control them from a remote location. This gave them the ability to steal information, hijack accounts, and launch cyberattacks. The malware could even trick users into downloading more malware or giving away their personal information.
The potential impact of ChatGPT malware is alarming. Here are some numbers to prove it:
These statistics show that cybercrime is on the rise, and that ChatGPT malware is just one more tool in a hacker's arsenal. It's essential to take action and stay vigilant to protect yourself and your device.
https://akash.mittal.blog/Watch-Out-for-ChatGPT-The-Emerging-Malware-Threat-TechRadar.html
#trending #ChatGPT #malware #cybersecurity #AI #IT #cybercrime ","","","linkedin","Akash Mittal","","","","","","2023-05-28-01-07-29-989","https://akash.mittal.blog/Watch-Out-for-ChatGPT-The-Emerging-Malware-Threat-TechRadar.html","https://akash.mittal.blog/images/Watch-Out-for-ChatGPT-The-Emerging-Malware-Threat-TechRadar.jpeg"
"2023-05-31 10:07 PM;","A lawyer, let's call him Tom, was in a rush to file a legal document for his client. He had a lot on his plate, and he thought it would be easier and quicker to use an online chatbot service. After all, the website promised to provide legal advice and create the necessary documents for a fixed fee. Tom entered all the required information, and the chatbot gave him a document that seemed professional and legitimate. Tom submitted the document, thinking that his job was done.
However, things didn't go as planned. A few days later, Tom's client received a notice from the court, saying that the document he had submitted was invalid. Tom was shocked and confused. How could that be possible? He had used an online service that promised to be reliable and accurate. Well, it turned out that the chatbot had cited nonexistent cases that it just made up. Tom had unknowingly submitted false information, which had put his client in a terrible situation.
This story might seem like an extreme case, but it's not uncommon. Many lawyers and legal professionals are turning to online services to save time and money, but not all of them are trustworthy or reliable. In this article, we will explore the dangers of using unreliable online legal services and provide some practical tips to avoid them.
According to a recent study by the American Bar Association, about 40% of legal consumers use online resources to research legal issues, and 35% use online resources to prepare legal documents. However, not all of these consumers are satisfied with the results. Another survey showed that only 39% of legal consumers who used online services felt that the services were worth the cost.
One of the biggest risks of using online legal services is the lack of personalized advice and support. Online services may provide generic documents that are not tailored to a specific case or situation. This can lead to errors and misunderstandings that can be costly and time-consuming to fix.
https://akash.mittal.blog/The-Dangers-of-Using-Unreliable-Online-Legal-Services.html
#trending #legal #onlineservices #chatbots #lawyers #consumers #reliability ","","","linkedin","Akash Mittal","","","","","","2023-05-28-01-07-29-989","https://akash.mittal.blog/The-Dangers-of-Using-Unreliable-Online-Legal-Services.html","https://akash.mittal.blog/images/The-Dangers-of-Using-Unreliable-Online-Legal-Services.jpeg"
"2023-05-31 11:07 PM;","Are you tired of not getting the most out of your ChatGPT experience? Do you want to be more effective and efficient in your chats? Look no further, because we have the tips you need to supercharge your ChatGPT experience!
Communication is an essential part of human interaction. It allows us to share our thoughts, ideas, and feelings with others. In today's society, communicating online has become the norm. Chatting over the internet is convenient, but it can sometimes lead to misunderstandings or misinterpretations. That's why it's essential to know how to communicate effectively and efficiently on ChatGPT.
I remember when I first started ChatGPT. I was excited to talk to people from different parts of the world, but I quickly realized that it wasn't as easy as I thought it would be. My chats weren't going well, and I didn't know what I was doing wrong. After some research and practice, I discovered some tips that helped me improve my experience. These tips not only helped me communicate better but also helped me make more meaningful connections with people.
Here are some quantifiable examples of how you can improve your ChatGPT experience:
Personal anecdotes and case studies can help illustrate how these tips can be applied in real-life situations:
https://akash.mittal.blog/Supercharge-your-ChatGPT-Experience-Proven-Tips-for-Increased-Sage-and-Effectivness.html
#trending #ChatGPT #ImproveChatExperience #EffectiveCommunication ","","","linkedin","Akash Mittal","","","","","","2023-05-28-01-07-29-989","https://akash.mittal.blog/Supercharge-your-ChatGPT-Experience-Proven-Tips-for-Increased-Sage-and-Effectivness.html","https://akash.mittal.blog/images/Supercharge-your-ChatGPT-Experience-Proven-Tips-for-Increased-Sage-and-Effectivness.jpeg"
"2023-06-01 12:07 AM;","Recently, a lawyer was caught citing bogus cases in court. The opposing counsel challenged the validity of the cases, and upon further investigation, it was discovered that the lawyer had relied on outdated and irrelevant sources for his research. When confronted, the lawyer admitted that he had not used any modern tools or technology to conduct his research.
This story highlights the importance of keeping up with the latest tools and technologies in the legal industry. As artificial intelligence (AI) continues to advance, it is becoming an increasingly valuable resource for lawyers and legal professionals.
AI can be used for a variety of tasks in the legal industry, including:
These examples demonstrate the ways in which AI can improve the efficiency and accuracy of legal work, saving time and resources while providing better outcomes for clients.
AI in the Legal Industry: How Cutting-Edge Technology is Transforming the Way Lawyers Work
https://akash.mittal.blog/Lawyer-Admits-Using-AI-for-Research-After-Citing-Bogus-Cases.html
#trending #AIinLaw #LegalTech #FutureofLaw ","","","linkedin","Akash Mittal","","","","","","2023-05-28-01-07-29-989","https://akash.mittal.blog/Lawyer-Admits-Using-AI-for-Research-After-Citing-Bogus-Cases.html","https://akash.mittal.blog/images/Lawyer-Admits-Using-AI-for-Research-After-Citing-Bogus-Cases.jpeg"
"2023-06-01 01:07 AM;","Imagine a world where common infections such as sinusitis, pneumonia, and urinary tract infections could no longer be treated with antibiotics. Where even simple wounds could become life-threatening due to antibiotic resistance. This may sound like the plot of a dystopian novel, but unfortunately, it's a very real threat that we are facing today.
Pathogenic bacteria have been evolving and adapting to antibiotics since they were first discovered in the early 1900s. However, the overuse and misuse of antibiotics in humans and animals have accelerated this process, leading to the emergence of drug-resistant bacteria, or superbugs.
Superbugs, such as Methicillin-resistant Staphylococcus aureus (MRSA) and Carbapenem-resistant Enterobacteriaceae (CRE), are resistant to multiple antibiotics and are responsible for thousands of deaths each year. Finding new antibiotics to combat these deadly superbugs has become a top priority for public health officials and researchers around the world.
The statistics surrounding antibiotic resistance are alarming. According to the World Health Organization:
These numbers highlight the urgent need for new antibiotics to combat drug-resistant infections.
https://akash.mittal.blog/AI-Battles-Superbugs-Finding-New-Antibiotic-Drugs-to-Combat-Drug-Resistant-Infections.html
#trending #antibioticresistance #drugdevelopment #newantibiotics #insilicomedicine ","","","linkedin","Akash Mittal","","","","","","2023-05-28-01-07-29-989","https://akash.mittal.blog/AI-Battles-Superbugs-Finding-New-Antibiotic-Drugs-to-Combat-Drug-Resistant-Infections.html","https://akash.mittal.blog/images/AI-Battles-Superbugs-Finding-New-Antibiotic-Drugs-to-Combat-Drug-Resistant-Infections.jpeg"
