"2023-05-29 07:46 PM;","Have you ever been in a situation where you needed to be charismatic and confident, but you just couldn't muster up the energy or the charm? It's happened to the best of us. Whether it's a job interview, a first date, or a public speaking engagement, sometimes we just don't have that certain je ne sais quoi that makes us stand out.
Enter EyeGlass.
EyeGlass is a revolutionary new technology that enables you to project charisma on demand. It's a pair of glasses that use cutting-edge facial recognition and artificial intelligence algorithms to analyze your surroundings and provide you with personalized cues on how to act, speak, and present yourself.
How effective is EyeGlass? According to a recent study, people who wore EyeGlass during a job interview were twice as likely to get hired than those who didn't. Another study showed that people who wore EyeGlass on a first date had a 80% success rate in getting a second date, compared to only 20% for those who didn't use EyeGlass.
But EyeGlass isn't just for high-stakes situations. It can be used in everyday life to boost your confidence and make you feel like a superstar. One user reported that wearing EyeGlass during a networking event helped him make more meaningful connections and land new business opportunities.
https://akash.mittal.blog/EyeGlass-The-Charisma-on-Demand-Enabler.html
#trending #EyeGlass #CharismaOnDemand #PersonalizedFeedback #FacialRecognition #ArtificialIntelligence #BoostConfidence #ImprovePerformance #ProjectCharisma #Technology #SocialSkills #ProfessionalSkills ","","","linkedin","Akash Mittal","","","","","","2023-05-26-07-46-29-880","https://akash.mittal.blog/EyeGlass-The-Charisma-on-Demand-Enabler.html","https://akash.mittal.blog/images/EyeGlass-The-Charisma-on-Demand-Enabler.jpeg"
"2023-05-29 08:46 PM;","Have you heard about Tako, the new AI chatbot being tested on TikTok?
If not, you're in for a treat. Tako is changing the way we interact with social media, and it's all thanks to some cutting-edge technology.
Tako was first introduced by TikTok in May of 2021 as a way to help creators connect with their audiences in a more meaningful way. With Tako, creators can set up automated responses to common questions and comments, freeing up more time for them to create content and engage with their fans.
But Tako is more than just a simple chatbot. It uses AI technology to learn from its interactions and improve over time. This means that the more people use Tako, the smarter it becomes.
It's still early days for Tako, but early results show a lot of promise. Creators who have used Tako report spending less time on administrative tasks and more time creating content. And their audiences love the more personalized responses they receive from Tako.
https://akash.mittal.blog/How-TikTok-Testing-New-AI-Chatbot-Tako-is-Changing-the-Game.html
#trending #Tako #Chatbot #AI #SocialMedia #Engagement ","","","linkedin","Akash Mittal","","","","","","2023-05-26-07-46-29-880","https://akash.mittal.blog/How-TikTok-Testing-New-AI-Chatbot-Tako-is-Changing-the-Game.html","https://akash.mittal.blog/images/How-TikTok-Testing-New-AI-Chatbot-Tako-is-Changing-the-Game.jpeg"
"2023-05-29 09:46 PM;","by Jane Doe
Imagine browsing through your YouTube home page and suddenly you come across a video that perfectly describes your personal interests, hobbies, and even your mental state. It's like somebody has been spying on you and analyzing every aspect of your life. But, is it really that surprising?
ChatGPT, a popular YouTube channel known for its IQ and personality tests, has recently come under investigation by Canadian privacy authorities. The authorities have raised concerns about the collection and use of personal information of its subscribers without their prior knowledge or consent.
In this article, we will discuss the potential risks and impacts of ChatGPT's use of personal information, the legal framework for data protection in Canada, and how individuals can protect their privacy online.
ChatGPT claims to use its subscribers' personal information to improve its content and to better serve its audience. However, the authorities have found that ChatGPT has been collecting more data than what is necessary for these purposes, and that the channel has been sharing this data with third parties, including advertisers.
https://akash.mittal.blog/Investigating-ChatGPT-s-Use-of-Personal-Information-on-YouTube.html
#trending #ChatGPT #Privacy #DataProtection #PIPEDA #OnlinePrivacy #CyberSecurity ","","","linkedin","Akash Mittal","","","","","","2023-05-26-07-46-29-880","https://akash.mittal.blog/Investigating-ChatGPT-s-Use-of-Personal-Information-on-YouTube.html","https://akash.mittal.blog/images/Investigating-ChatGPT-s-Use-of-Personal-Information-on-YouTube.jpeg"
"2023-05-29 04:05 PM;","The advent of technology has seen the emergence of Artificial Intelligence as a significant invention in warfare systems. AI has been crucial in the development of unmanned aerial vehicles, autonomous submarines, and other military technologies. The U.S and China are currently leading the world in this space, with the race to technological superiority showing no signs of slowing down. As both countries continue to advance their AI capabilities, it is anticipated that the race to AI development can result in an impending conflict between the two nations. This article delves deeper into AI Algorithmic Warfare and the Coming U.S-China Conflict.
In the early days of warfare, soldiers would engage in hand-to-hand combat with the enemy in a theater of war. However, in modern warfare, we have seen the development of drones and autonomous weapons capable of causing significant damage without the direct involvement of personnel. AI-powered weapons systems have been successful in targeting and eliminating threats without putting humans in harm's way. This technology has significantly revolutionized the execution of warfare operations.
AI Algorithmic Warfare involves the use of algorithms to identify, target, and destroy both stationary and moving targets. The algorithms analyze the information received from various data sources and then make crucial decisions on the course of action. This method is particularly useful in modern warfare, as it allows military forces to operate without putting their personnel at risk.
The United States and China are leading the global race in AI technology. China is competing to become a dominant global superpower, with the development of AI and military technology as top priorities. Similarly, the United States is seeking to maintain its position as the world's leading superpower, leveraging its AI capabilities to increase military efficiency and automation. The race for AI technological superiority has led the two nations on a collision course that is likely to result in a conflict.
The U.S military has already started testing autonomous drones and other AI-powered weapons systems. The 2019 National Defense Authorization Act authorized expenditure on expanding and developing AI technologies in the U.S military. China's military has contracted various artificial intelligence firms to develop AI-powered weapons systems. The firms are competing against each other to produce the most superior AI technology that will give the Chinese military an edge over its rivals.
https://akash.mittal.blog/AI-Algorithmic-Warfare-and-the-Coming-U-S-China-Conflict.html
#trending #AIAlgorithmicWarfare #USChinaConflict #AIinMilitary #AIinWarfare #FutureofAI ","","","linkedin","Akash Mittal","","","","","","2023-05-26-14-05-45-873","https://akash.mittal.blog/AI-Algorithmic-Warfare-and-the-Coming-U-S-China-Conflict.html","https://akash.mittal.blog/images/AI-Algorithmic-Warfare-and-the-Coming-U-S-China-Conflict.jpeg"
"2023-05-29 05:05 PM;","Once upon a time, searching for information on the internet meant typing keywords into a search engine and hoping the results were relevant and useful. But with the launch of Google's new AI-powered search engine, the game has changed.
Using advanced machine learning algorithms, the new search engine is able to understand the context of a search query and provide results that are more tailored to the user's needs.
So how can you sign up for this revolutionary new search engine? It's simple:
But what about those who are hesitant to try new technology or fear that their data might be compromised? Here are a few tips to ease those concerns:
Google's new AI-powered search engine is a game changer in the world of internet search. With more relevant and personalized results, users can save time and frustration when trying to find the information they need. Signing up is simple and safe, and users have the option to opt out of personalized results if they choose. Give the new search engine a try and see for yourself!
https://akash.mittal.blog/Google-Launches-New-AI-Search-Engine-How-to-Sign-Up.html
#trending #GoogleAIsearch #newsearchengine #tailoredresults #morepersonlization #machinelearning ","","","linkedin","Akash Mittal","","","","","","2023-05-26-14-05-45-873","https://akash.mittal.blog/Google-Launches-New-AI-Search-Engine-How-to-Sign-Up.html","https://akash.mittal.blog/images/Google-Launches-New-AI-Search-Engine-How-to-Sign-Up.jpeg"
"2023-05-29 06:05 PM;","By [Your Name], Published on
Imagine a world where artificial intelligence (AI) makes important decisions for us. From healthcare to finances, AI can be incredibly helpful in making complex decisions. However, what if the AI makes a mistake?
A recent study found that AI systems are not always accurate and can make biased decisions. For example, facial recognition software tends to misidentify people of color at a higher rate than white individuals. This highlights the need for AI guardrails to ensure transparency, accountability, and fairness in decision-making.
As one of the leading technology companies in the world, Microsoft is taking steps to address this issue and urging other companies and policymakers to do the same.
Microsoft has been working on its own AI ethics principles since 2018. The company has committed to developing AI in a way that is transparent, responsible, and ethical. This includes ensuring that AI systems are designed to be unbiased, secure, and protect privacy.
https://akash.mittal.blog/Microsoft-Urges-Lawmakers-and-Companies-to-Step-Up-with-AI-Guardrails.html
#trending #AIethics #Microsoft #AIguardrails #transparency #accountability ","","","Facebook","Dave's Academy","","","","","","2023-05-26-14-05-45-873","https://akash.mittal.blog/Microsoft-Urges-Lawmakers-and-Companies-to-Step-Up-with-AI-Guardrails.html","https://akash.mittal.blog/images/Microsoft-Urges-Lawmakers-and-Companies-to-Step-Up-with-AI-Guardrails.jpeg"
"2023-05-29 06:05 PM;","By [Your Name], Published on
Imagine a world where artificial intelligence (AI) makes important decisions for us. From healthcare to finances, AI can be incredibly helpful in making complex decisions. However, what if the AI makes a mistake?
A recent study found that AI systems are not always accurate and can make biased decisions. For example, facial recognition software tends to misidentify people of color at a higher rate than white individuals. This highlights the need for AI guardrails to ensure transparency, accountability, and fairness in decision-making.
As one of the leading technology companies in the world, Microsoft is taking steps to address this issue and urging other companies and policymakers to do the same.
Microsoft has been working on its own AI ethics principles since 2018. The company has committed to developing AI in a way that is transparent, responsible, and ethical. This includes ensuring that AI systems are designed to be unbiased, secure, and protect privacy.
https://akash.mittal.blog/Microsoft-Urges-Lawmakers-and-Companies-to-Step-Up-with-AI-Guardrails.html
#trending #AIethics #Microsoft #AIguardrails #transparency #accountability ","","","linkedin","Dave's Academy","","","","","","2023-05-26-14-05-45-873","https://akash.mittal.blog/Microsoft-Urges-Lawmakers-and-Companies-to-Step-Up-with-AI-Guardrails.html","https://akash.mittal.blog/images/Microsoft-Urges-Lawmakers-and-Companies-to-Step-Up-with-AI-Guardrails.jpeg"
"2023-05-29 07:05 PM;","Credit: Isabella Vosmikova for Rolling Stone
Summer Walker, known for her R&B hits like ""Girls Need Love"" and ""Playing Games,"" recently opened up about her struggles with postpartum depression and being a single parent in an interview with Rolling Stone.
Walker revealed that after giving birth to her daughter last year, she experienced intense feelings of sadness and anxiety that she couldn't shake.
""I felt like I was in a deep hole,"" Walker told Rolling Stone. ""I didn't want to get out of bed, I didn't want to eat, I didn't want to do anything. It was really scary.""
Postpartum depression affects up to 20% of new mothers, according to the Centers for Disease Control and Prevention (CDC). The condition can cause feelings of sadness, anxiety, and exhaustion that interfere with daily life.
https://akash.mittal.blog/Summer-Walker-Opens-Up-on-Postpartum-Depression-and-Single-Parenting.html
#trending #SummerWalker #PostpartumDepression #SingleParenting #MentalHealth #ParentingTips #SupportSystem #MaternalMentalHealth #Awareness ","","","Facebook","Dave's Academy","","","","","","2023-05-26-14-05-45-873","https://akash.mittal.blog/Summer-Walker-Opens-Up-on-Postpartum-Depression-and-Single-Parenting.html","https://akash.mittal.blog/images/Summer-Walker-Opens-Up-on-Postpartum-Depression-and-Single-Parenting.jpeg"
"2023-05-29 07:05 PM;","Credit: Isabella Vosmikova for Rolling Stone
Summer Walker, known for her R&B hits like ""Girls Need Love"" and ""Playing Games,"" recently opened up about her struggles with postpartum depression and being a single parent in an interview with Rolling Stone.
Walker revealed that after giving birth to her daughter last year, she experienced intense feelings of sadness and anxiety that she couldn't shake.
""I felt like I was in a deep hole,"" Walker told Rolling Stone. ""I didn't want to get out of bed, I didn't want to eat, I didn't want to do anything. It was really scary.""
Postpartum depression affects up to 20% of new mothers, according to the Centers for Disease Control and Prevention (CDC). The condition can cause feelings of sadness, anxiety, and exhaustion that interfere with daily life.
https://akash.mittal.blog/Summer-Walker-Opens-Up-on-Postpartum-Depression-and-Single-Parenting.html
#trending #SummerWalker #PostpartumDepression #SingleParenting #MentalHealth #ParentingTips #SupportSystem #MaternalMentalHealth #Awareness ","","","linkedin","Dave's Academy","","","","","","2023-05-26-14-05-45-873","https://akash.mittal.blog/Summer-Walker-Opens-Up-on-Postpartum-Depression-and-Single-Parenting.html","https://akash.mittal.blog/images/Summer-Walker-Opens-Up-on-Postpartum-Depression-and-Single-Parenting.jpeg"
"2023-05-29 08:05 PM;","It was a beautiful day for baseball in Bemidji as the hometown team faced off against their rival in a crucial section matchup. The stands were packed with eager fans, all hoping to see their team come out on top. As the game got underway, it quickly became apparent that this was going to be a hard-fought battle.
The visiting team came out strong, getting an early lead thanks to some aggressive base running and timely hits. Bemidji, on the other hand, struggled at the plate, striking out several times and leaving runners stranded on base. As the innings rolled by, the tension in the air was palpable. Would Bemidji be able to mount a comeback, or would they fall to their rivals once again?
It wasn't until the final inning that the tide began to turn in Bemidji's favor. With two outs and two runners on base, the team's star player stepped up to the plate. With a crack of the bat, he sent the ball sailing over the fence for a three-run homer, sending the crowd into a frenzy. Bemidji had done it - they had rallied back to win the game in stunning fashion.
This victory was no small feat. It was a key win in the team's push for the playoffs, and it showed that Bemidji had what it takes to compete with the best teams in the section. But what made this win possible? Let's take a closer look at some of the factors that contributed to Bemidji's success.
One of the biggest factors in Bemidji's win was their pitching. Despite giving up some early runs, the team's pitchers settled in and started to shut down the opposition. They mixed up their pitches effectively, keeping the hitters off-balance and inducing weak contact. In the later innings, when the game was on the line, the pitchers kept their composure and made some crucial pitches to get out of jams.
https://akash.mittal.blog/Bemidji-Splits-Doubleheader-with-Late-Rally-to-Get-Key-Section-Win.html
#trending #BemidjiBaseball #PlayoffPush #TeamworkMakesTheDreamWork ","","","Facebook","Dave's Academy","","","","","","2023-05-26-14-05-45-873","https://akash.mittal.blog/Bemidji-Splits-Doubleheader-with-Late-Rally-to-Get-Key-Section-Win.html","https://akash.mittal.blog/images/Bemidji-Splits-Doubleheader-with-Late-Rally-to-Get-Key-Section-Win.jpeg"
"2023-05-29 08:05 PM;","It was a beautiful day for baseball in Bemidji as the hometown team faced off against their rival in a crucial section matchup. The stands were packed with eager fans, all hoping to see their team come out on top. As the game got underway, it quickly became apparent that this was going to be a hard-fought battle.
The visiting team came out strong, getting an early lead thanks to some aggressive base running and timely hits. Bemidji, on the other hand, struggled at the plate, striking out several times and leaving runners stranded on base. As the innings rolled by, the tension in the air was palpable. Would Bemidji be able to mount a comeback, or would they fall to their rivals once again?
It wasn't until the final inning that the tide began to turn in Bemidji's favor. With two outs and two runners on base, the team's star player stepped up to the plate. With a crack of the bat, he sent the ball sailing over the fence for a three-run homer, sending the crowd into a frenzy. Bemidji had done it - they had rallied back to win the game in stunning fashion.
This victory was no small feat. It was a key win in the team's push for the playoffs, and it showed that Bemidji had what it takes to compete with the best teams in the section. But what made this win possible? Let's take a closer look at some of the factors that contributed to Bemidji's success.
One of the biggest factors in Bemidji's win was their pitching. Despite giving up some early runs, the team's pitchers settled in and started to shut down the opposition. They mixed up their pitches effectively, keeping the hitters off-balance and inducing weak contact. In the later innings, when the game was on the line, the pitchers kept their composure and made some crucial pitches to get out of jams.
https://akash.mittal.blog/Bemidji-Splits-Doubleheader-with-Late-Rally-to-Get-Key-Section-Win.html
#trending #BemidjiBaseball #PlayoffPush #TeamworkMakesTheDreamWork ","","","linkedin","Dave's Academy","","","","","","2023-05-26-14-05-45-873","https://akash.mittal.blog/Bemidji-Splits-Doubleheader-with-Late-Rally-to-Get-Key-Section-Win.html","https://akash.mittal.blog/images/Bemidji-Splits-Doubleheader-with-Late-Rally-to-Get-Key-Section-Win.jpeg"
"2023-05-29 09:05 PM;","When most people think about artificial intelligence (AI), they often picture robots with human-like intelligence. While this is certainly a compelling vision, the reality is that many of the most exciting AI use cases don't involve humanoid machines at all. In fact, some of the most promising applications of AI are already in use today, and they have nothing to do with ChatGPT.
Despite the hype around ChatGPT, there are far more innovative and impactful AI applications being developed. Here are five that are worth paying attention to:
One of the most promising applications of AI is in the field of predictive maintenance. Using machine learning algorithms, companies can analyze vast amounts of real-time data from IoT-connected devices and predict when they're likely to fail. By fixing equipment before it breaks down, companies can save millions of dollars in repair costs and lost productivity.
For example, Airbus uses machine learning to predict when components on their aircraft are likely to fail. By doing so, they can proactively replace parts before they cause problems, reducing downtime and improving overall reliability.
By 2024, the global market for predictive maintenance is projected to be worth $10.7 billion, making it one of the most promising AI use cases to watch in the coming years.
https://akash.mittal.blog/5-AI-Use-Cases-More-Promising-Than-ChatGPT.html
#trending #AIUseCases #ChatGPTAlternative #MachineLearning #DeepLearning #Robotics #ComputerVision #NaturalLanguageProcessing #WarehouseAutomation #PredictiveMaintenance #DrugDiscovery ","","","linkedin","Akash Mittal","","","","","","2023-05-26-14-05-45-873","https://akash.mittal.blog/5-AI-Use-Cases-More-Promising-Than-ChatGPT.html","https://akash.mittal.blog/images/5-AI-Use-Cases-More-Promising-Than-ChatGPT.jpeg"
"2023-05-29 10:05 PM;","It was a typical day at the grocery store with my 2-year-old daughter. We were walking down the cereal aisle when she spotted her favorite box of sugary cereal and reached out to grab it. I calmly told her that we weren't going to buy that cereal today and tried to redirect her attention to a healthier option. That's when it happened.
My daughter's face contorted into a red, angry mess as she let out a blood-curdling scream. She stomped her feet and began furiously grabbing at boxes of cereal around her. I could feel everyone's judging eyes on us as I tried my best to calm her down and carry her out of the store. It felt like the longest walk of my life.
If you're a parent, you've likely experienced a similar scenario with your own toddler. Tantrums are one of the most common challenges parents face with young children. But don't worry, there are strategies you can use to help de-escalate the situation and teach your child healthy coping mechanisms.
A study by the Journal of Child Psychology and Psychiatry found that toddlers throw an average of one tantrum per day. That's 365 emotional outbursts in a year! The study also found that the most common triggers for tantrums are when a child is tired, hungry, or wanting attention.
Another study by Pediatrics showed that tantrums can last anywhere from 90 seconds to 20 minutes. That may not sound like a long time, but anyone who has witnessed a toddler meltdown knows that it can feel like an eternity.
https://akash.mittal.blog/How-to-Help-with-Toddler-Meltdowns-Today-s-Parent.html
#trending #toddlermeltdowns #parentingtips #childbehavior #tantrumssolutions ","","","Facebook","Dave's Academy","","","","","","2023-05-26-14-05-45-873","https://akash.mittal.blog/How-to-Help-with-Toddler-Meltdowns-Today-s-Parent.html","https://akash.mittal.blog/images/How-to-Help-with-Toddler-Meltdowns-Today-s-Parent.jpeg"
"2023-05-29 10:05 PM;","It was a typical day at the grocery store with my 2-year-old daughter. We were walking down the cereal aisle when she spotted her favorite box of sugary cereal and reached out to grab it. I calmly told her that we weren't going to buy that cereal today and tried to redirect her attention to a healthier option. That's when it happened.
My daughter's face contorted into a red, angry mess as she let out a blood-curdling scream. She stomped her feet and began furiously grabbing at boxes of cereal around her. I could feel everyone's judging eyes on us as I tried my best to calm her down and carry her out of the store. It felt like the longest walk of my life.
If you're a parent, you've likely experienced a similar scenario with your own toddler. Tantrums are one of the most common challenges parents face with young children. But don't worry, there are strategies you can use to help de-escalate the situation and teach your child healthy coping mechanisms.
A study by the Journal of Child Psychology and Psychiatry found that toddlers throw an average of one tantrum per day. That's 365 emotional outbursts in a year! The study also found that the most common triggers for tantrums are when a child is tired, hungry, or wanting attention.
Another study by Pediatrics showed that tantrums can last anywhere from 90 seconds to 20 minutes. That may not sound like a long time, but anyone who has witnessed a toddler meltdown knows that it can feel like an eternity.
https://akash.mittal.blog/How-to-Help-with-Toddler-Meltdowns-Today-s-Parent.html
#trending #toddlermeltdowns #parentingtips #childbehavior #tantrumssolutions ","","","linkedin","Dave's Academy","","","","","","2023-05-26-14-05-45-873","https://akash.mittal.blog/How-to-Help-with-Toddler-Meltdowns-Today-s-Parent.html","https://akash.mittal.blog/images/How-to-Help-with-Toddler-Meltdowns-Today-s-Parent.jpeg"
