"2023-05-30 08:47 AM;","When I was young, I always dreamed of becoming a writer. Being able to create stories that would capture the hearts and minds of readers was something that fascinated me. However, as I grew older, that dream started to fade. It seemed like an impossible venture - a world reserved only for a select few.
It wasn't until I stumbled upon the MyAnimeList Honeyfeed 3rd Web Novel Contest that my passion for writing was reignited. The contest provided a platform where aspiring writers could showcase their work to a wider audience and even win some amazing prizes.
The MyAnimeList Honeyfeed 3rd Web Novel Contest is an annual competition organized by MyAnimeList and Honeyfeed. The contest is open to writers from all over the world, and the aim is to find and promote new talent in the world of web novels.
Participants are required to submit a web novel of at least three chapters and a total of 10,000 words. The submissions are then evaluated by a panel of judges based on the following criteria:
The MyAnimeList Honeyfeed 3rd Web Novel Contest is not just another writing competition. It offers several benefits to aspiring writers, and here are some of them:
https://akash.mittal.blog/The-MyAnimeList-Honeyfeed-3rd-Web-Novel-Contest-A-Gateway-for-Aspiring-Writers.html
#trending #about #benefits #tips #reference #MyAnimeList #Honeyfeed #WebNovelContest ","","","linkedin","Akash Mittal","","","","","","2023-05-26-01-47-01-593","https://akash.mittal.blog/The-MyAnimeList-Honeyfeed-3rd-Web-Novel-Contest-A-Gateway-for-Aspiring-Writers.html","https://akash.mittal.blog/images/The-MyAnimeList-Honeyfeed-3rd-Web-Novel-Contest-A-Gateway-for-Aspiring-Writers.jpeg"
"2023-05-30 09:47 AM;","Have you ever imagined the day when technology would help a paralyzed individual to walk again? With the development of artificial intelligence (AI), this has become a reality. AI is helping to revolutionize medical procedures around the world, including the possibility for paralyzed individuals to walk again. Let's explore how.
Meet James, a young man who was paralyzed after a tragic car accident. James had always been an active person, and the thought of never walking again devastated him. However, with the help of technology and medical professionals, James was able to undergo a procedure that completely changed his life.
Doctors implanted a device into James's spinal cord that, with the help of artificial intelligence, was able to send signals from his brain to his legs. After a few months of rehabilitation and training, James was able to stand up and walk again.
The use of artificial intelligence in medical procedures has shown incredible results across the board. For example, in one study, paralyzed patients who received a spinal cord implant with AI technology, were able to regain partial or complete movement. The study reported that 70% of patients regained significant function after a year of use, while 80% retained the ability to walk with crutches or a walker.
Another example is from a medical institution that developed a robotic exoskeleton assistance suit called HAL. In clinical trials, patients who used HAL were able to walk up to 200 meters without assistance after just a few months of training.
https://akash.mittal.blog/Artificial-Intelligence-in-Medical-Procedure-Helping-a-Paralyzed-Man-Walk.html
#trending #ArtificialIntelligence #MedicalProcedure #ParalyzedMan #Walking #Technology #Innovation ","","","linkedin","Akash Mittal","","","","","","2023-05-26-01-47-01-593","https://akash.mittal.blog/Artificial-Intelligence-in-Medical-Procedure-Helping-a-Paralyzed-Man-Walk.html","https://akash.mittal.blog/images/Artificial-Intelligence-in-Medical-Procedure-Helping-a-Paralyzed-Man-Walk.jpeg"
"2023-05-30 10:47 AM;","When Thomas was growing up in the 90s, watching television was a communal experience in his household. His family would all gather around the screen, waiting for their favorite shows to come on at a scheduled time. But now, as an adult, he finds himself alone in his apartment, scrolling through endless streaming options on his laptop.
The TV industry has undergone a dramatic transformation in the last decade, with the rise of streaming and on-demand services completely disrupting the traditional model. But the innovation doesn't stop there - Web3 technology promises even more disruption and democratization of the media industry.
Already, there are notable examples of Web3 in action in the media industry. For example, the blockchain-based platform Theta.tv allows content creators to directly monetize their content through token rewards from viewers. Meanwhile, Decentralized Finance (DeFi) applications can help fund independent film projects or support media-focused non-profits.
Furthermore, Big Tech companies like Google and Facebook are facing increasing scrutiny and regulations on data privacy and monopolistic practices - and Web3 offers a solution. Decentralized Web3 platforms can ensure data privacy for users and provide a more equitable distribution of content ownership and revenue.
Web3 and the Democratization of Media: A New Era of Creativity and Ownership
https://akash.mittal.blog/Can-Web3-Really-Deliver-for-the-Media-Industry.html
#trending #Web3Media #Decentralization #BlockchainRevolution #ContentCreators #DataPrivacyMatters #FairDistribution ","","","linkedin","Akash Mittal","","","","","","2023-05-26-01-47-01-593","https://akash.mittal.blog/Can-Web3-Really-Deliver-for-the-Media-Industry.html","https://akash.mittal.blog/images/Can-Web3-Really-Deliver-for-the-Media-Industry.jpeg"
"2023-05-30 11:47 AM;","When tech giant, Google, first unveiled its Artificial Intelligence (AI) technology capable of beating the world's best human players at the complex game of Go in 2016, the tech world was stunned. It brought home the realisation that AI is no longer considered a technological pipe dream.
AI is among the fastest-growing technologies today, and its impact has been felt in almost every industry, including the computer chip industry. With the integration of AI, the industry is seeing radical change at a pace that many never thought possible.
AI is revolutionising the way the computer chip industry operates. Below are some quantifiable examples of how AI is reshaping the industry:
AI has positioned itself as a vital component of the computer chip industry, facilitating the development of new technologies that not only outperform others but are also more efficient and reliable. These developments have revolutionised the industry in the following ways:
In conclusion, the integration of AI in the computer chip industry has entirely transformed the industry, making it more efficient, innovative, and reliable. The industry can also produce cost-effective chips and keep up with the incessantly growing demand. AI technology is continually evolving, and its impact on the computer chip industry is yet to be fully realised.
https://akash.mittal.blog/How-AI-is-Reshaping-the-Computer-Chip-Industry.html
#trending #AI #ChipDesign #ComputerChips #Automation #NeuralNetworks #MachineLearning ","","","linkedin","Akash Mittal","","","","","","2023-05-26-01-47-01-593","https://akash.mittal.blog/How-AI-is-Reshaping-the-Computer-Chip-Industry.html","https://akash.mittal.blog/images/How-AI-is-Reshaping-the-Computer-Chip-Industry.jpeg"
"2023-05-30 12:47 PM;","It was a sweltering day in Washington D.C. and the Senate hearing room was crowded with politicians, lobbyists and journalists. Elon Musk, the CEO of Tesla and SpaceX had been called to testify about the future of artificial intelligence (AI), and the impact it would have on humanity. As the hearing began, Musk laid out his vision for an AI-powered future; one where machines were more intelligent than humans, but where humanity could still have a meaningful role to play.
However, as the hearing wore on, the mood in the room began to shift. Musk's optimistic vision for AI began to clash with the concerns of lawmakers and regulators who were worried about the safety and security of these new technologies. One by one, senators quizzed Musk on how he planned to keep machines from harming humans, and how he would ensure that companies didn't misuse their power. Musk's answers were reassuring, but not enough to allay the concerns of those in the room.
This scene played out in 2017, but the words spoken by Musk and the senators are just as relevant today. As AI technologies continue to advance at a breakneck pace, regulators around the world are scrambling to keep up. Governments are passing new laws and regulations aimed at protecting citizens from the risks posed by AI, while at the same time trying to foster innovation and economic growth.
The impact of AI is being felt across a wide array of industries, from healthcare and finance to transportation and retail. In healthcare, AI algorithms are being used to help doctors diagnose diseases and identify the best treatments. In finance, AI is being used to detect fraud and manage risks. In transportation, self-driving cars are poised to revolutionize the way we travel. And in retail, AI-powered chatbots are transforming the way we interact with brands and make purchases.
AI is also having a profound impact on the workforce. While some jobs are being automated out of existence, others are being augmented by AI technologies. As OpenAI warns, a significant number of jobs in the next 5-10 years will become obsolete, necessitating the need for reskilling and upskilling for all workers in the economy, as well as a re-thinking by policymakers of the social safety-nets for workers.
https://akash.mittal.blog/OpenAI-warns-over-split-with-Europe-as-regulation-advances.html
#trending #ArtificialIntelligence #OpenAI #AIRegulation ","","","linkedin","Akash Mittal","","","","","","2023-05-26-01-47-01-593","https://akash.mittal.blog/OpenAI-warns-over-split-with-Europe-as-regulation-advances.html","https://akash.mittal.blog/images/OpenAI-warns-over-split-with-Europe-as-regulation-advances.jpeg"
"2023-05-30 01:47 PM;","It was a special day for Frank and Mary when they finalized the adoption papers for their 6-year-old son. They were in their 60s, and it was not their first time raising a child. However, this journey was different from the first one. The couple had to consider their physical health and stamina in addition to their financial stability before going ahead with the adoption process.
Frank and Mary are one of the many couples who are parenting yet again in their 60s. According to the data from the Administration for Children and Families, the number of adoptions by people over 60 has risen by over 30% in the last decade. While the decision to adopt at this stage of life can be challenging, it can also bring immense joy and fulfillment.
Parenting is never easy, and it becomes even more challenging as you age. The physical and emotional toll of taking care of a child increases as you grow older. Here are some struggles that Frank and Mary faced while adopting at their age:
Despite the struggles, adopting at an older age can bring immense joy and fulfillment. Here are some joys that Frank and Mary experienced while parenting their adopted child:
Adopting at an older age can be both challenging and rewarding. It is important to consider your physical and financial health before going ahead with the adoption process. While there are struggles, adopting can bring immense joy and fulfillment. Frank and Mary's journey is a testament to that!
https://akash.mittal.blog/Parenting-Yet-Again-in-Their-60s-Balancing-the-Struggles-and-Joys-of-Adoption.html
#trending #adoption #parenting #olderparents #adoptionjourney #family ","","","Facebook","Dave's Academy","","","","","","2023-05-26-01-47-01-593","https://akash.mittal.blog/Parenting-Yet-Again-in-Their-60s-Balancing-the-Struggles-and-Joys-of-Adoption.html","https://akash.mittal.blog/images/Parenting-Yet-Again-in-Their-60s-Balancing-the-Struggles-and-Joys-of-Adoption.jpeg"
"2023-05-30 01:47 PM;","It was a special day for Frank and Mary when they finalized the adoption papers for their 6-year-old son. They were in their 60s, and it was not their first time raising a child. However, this journey was different from the first one. The couple had to consider their physical health and stamina in addition to their financial stability before going ahead with the adoption process.
Frank and Mary are one of the many couples who are parenting yet again in their 60s. According to the data from the Administration for Children and Families, the number of adoptions by people over 60 has risen by over 30% in the last decade. While the decision to adopt at this stage of life can be challenging, it can also bring immense joy and fulfillment.
Parenting is never easy, and it becomes even more challenging as you age. The physical and emotional toll of taking care of a child increases as you grow older. Here are some struggles that Frank and Mary faced while adopting at their age:
Despite the struggles, adopting at an older age can bring immense joy and fulfillment. Here are some joys that Frank and Mary experienced while parenting their adopted child:
Adopting at an older age can be both challenging and rewarding. It is important to consider your physical and financial health before going ahead with the adoption process. While there are struggles, adopting can bring immense joy and fulfillment. Frank and Mary's journey is a testament to that!
https://akash.mittal.blog/Parenting-Yet-Again-in-Their-60s-Balancing-the-Struggles-and-Joys-of-Adoption.html
#trending #adoption #parenting #olderparents #adoptionjourney #family ","","","linkedin","Dave's Academy","","","","","","2023-05-26-01-47-01-593","https://akash.mittal.blog/Parenting-Yet-Again-in-Their-60s-Balancing-the-Struggles-and-Joys-of-Adoption.html","https://akash.mittal.blog/images/Parenting-Yet-Again-in-Their-60s-Balancing-the-Struggles-and-Joys-of-Adoption.jpeg"
"2023-05-30 02:47 PM;","Kevin Brazile had been paralyzed from the waist down for 22 years. He never thought walking again would be possible until he became a participant in a groundbreaking experimental treatment that used Artificial Intelligence to stimulate nerve cells in his spinal cord.
Brazile was one of four people who received the implant as part of the clinical trial at the Mayo Clinic, in Rochester, Minnesota. Through a series of exercises and months of physical therapy, he regained enough control over his muscles and nerves to walk on his own.
""It was the most amazing thing that ever happened to me,"" Brazile said in a video released by the Mayo Clinic. ""The implant changed my life completely.""
The implant, which is about the size of a dime, is placed on the spinal cord, under the skin. It contains an array of electrodes that send electrical impulses directly to the nerve cells. The impulses mimic the signals that the brain sends to the muscles, allowing the patient to move their legs voluntarily.
The implant is controlled by an Artificial Intelligence system that adjusts the signals based on the patient's movement and muscle activity. It can also learn and adapt to the patient's individual needs, optimizing the stimulation to achieve the best results.
https://akash.mittal.blog/Paralyzed-Man-Walks-Again-Artificial-Intelligence-in-Medical-Procedure.html
#trending #AIinHealthcare #MedicalBreakthrough #SpinalCordImplant ","","","linkedin","Akash Mittal","","","","","","2023-05-26-01-47-01-593","https://akash.mittal.blog/Paralyzed-Man-Walks-Again-Artificial-Intelligence-in-Medical-Procedure.html","https://akash.mittal.blog/images/Paralyzed-Man-Walks-Again-Artificial-Intelligence-in-Medical-Procedure.jpeg"
"2023-05-30 03:47 PM;","The Deadpool franchise has been a huge success since the first movie was released in 2016. Ryan Reynolds' portrayal of the foul-mouthed, wisecracking anti-hero has won over fans all over the world. However, fans have been eagerly awaiting news about the next installment of the franchise, and it seems like we finally have some answers.
In a recent interview with MovieWeb, Rob Liefeld, the creator of the character Deadpool, revealed that Deadpool 3 was going to be more of a Wolverine movie. He explained that the upcoming movie would focus on the relationship between Deadpool and Wolverine and that the two characters would have a lot of screen time together.
This news has been met with both excitement and skepticism from fans. Some are thrilled to see the two iconic characters sharing the screen together, while others worry that this could be a ploy to capitalize on the popularity of Hugh Jackman's Wolverine character.
While we don't have any details about the plot of Deadpool 3, we can look at some examples of how the two characters have interacted in the past. In the comics, Deadpool and Wolverine have a complicated relationship. They have fought each other numerous times, but they have also teamed up to take on common enemies.
One example of their dynamic was in the comic series ""Enemy of the State."" In this story, Wolverine is brainwashed and sent on a killing spree by the evil organization Hydra. Deadpool is sent to take out Wolverine, but instead, the two end up teaming up to take down Hydra.
https://akash.mittal.blog/Deadpool-3-Is-Way-More-of-a-Wolverine-Movie.html
#trending #Deadpool3 #WolverineMovie #RyanReynolds #HughJackman ","","","linkedin","Akash Mittal","","","","","","2023-05-26-01-47-01-593","https://akash.mittal.blog/Deadpool-3-Is-Way-More-of-a-Wolverine-Movie.html","https://akash.mittal.blog/images/Deadpool-3-Is-Way-More-of-a-Wolverine-Movie.jpeg"
"2023-05-30 04:47 PM;","On a sunny day in October 1962, the world was on the brink of nuclear war. The Soviet Union had installed missiles in Cuba, and the United States was prepared to take military action. While many people were bracing for an uncertain future, one man was quietly working behind the scenes to try to prevent the worst from happening. His name was Vasili Arkhipov, a Soviet submarine officer who had the power to launch a nuclear torpedo at the U.S. fleet. During a tense standoff, he refused to authorize the torpedo and averted disaster.
Today, we face a different kind of threat: the potential for artificial intelligence (AI) to trigger a nuclear catastrophe. While the idea of nuclear war is familiar to most of us, the dangers posed by AI may not be as well understood. However, the risks are very real, and the consequences could be even more devastating than a nuclear explosion.
The best way to understand the dangers of AI is to look at some quantifiable examples. For instance, in 2017, a group of researchers from the University of Cambridge released a report that predicted a high risk of accidental nuclear war due to the deployment of AI systems. The report highlighted several areas where AI could pose a threat, including:
Other experts have warned of the risks posed by ""killer robots"" or autonomous weapons that could make their own decisions about when to fire, without human oversight or control. These weapons could be programmed to target specific groups of people based on their ethnicity, religion, or other characteristics, leading to a humanitarian disaster.
The title of this article, ""AI vs Nukes: This is Much More Dangerous,"" is designed to grab the reader's attention and highlight the urgency of the issue. It suggests that while nuclear weapons have long been seen as the ultimate threat to global security, the dangers posed by AI are even greater, and must be taken seriously.
https://akash.mittal.blog/AI-vs-Nukes-This-is-Much-More-Dangerous.html
#trending #AIVSNukes #NuclearWar #GlobalSecurity ","","","linkedin","Akash Mittal","","","","","","2023-05-26-01-47-01-593","https://akash.mittal.blog/AI-vs-Nukes-This-is-Much-More-Dangerous.html","https://akash.mittal.blog/images/AI-vs-Nukes-This-is-Much-More-Dangerous.jpeg"
"2023-05-30 05:47 PM;","As a new parent, it's easy to feel like you're not doing everything right. From sleepless nights to endless tantrums, it can seem like there's no end to the challenges that come with raising a child. But fear not! We've rounded up 50 amazing products that will make you feel like you're absolutely nailing this parenting thing.
""I was skeptical about the Owlet Smart Sock at first, but after using it for a few nights, I was hooked. It gave me so much peace of mind to be able to check on my baby's oxygen levels and heart rate from my phone.""
""The Baby Brezza Formula Dispenser made life so much easier for me when I went back to work. I could set it up at night and it would automatically mix and warm bottles for me in the morning. It saved me so much time and hassle.""
""I never knew how much I needed the DockATot until I tried it. My baby slept so much better in it, and I loved that I could take it with me wherever we went.""
© 2022 All rights reserved.
https://akash.mittal.blog/50-Parenting-Products-That-ll-Make-You-Feel-Like-a-Pro-Buzzfeed.html
#trending #parentingproducts #happyparents #familyfun ","","","Facebook","Dave's Academy","","","","","","2023-05-26-01-47-01-593","https://akash.mittal.blog/50-Parenting-Products-That-ll-Make-You-Feel-Like-a-Pro-Buzzfeed.html","https://akash.mittal.blog/images/50-Parenting-Products-That-ll-Make-You-Feel-Like-a-Pro-Buzzfeed.jpeg"
"2023-05-30 05:47 PM;","As a new parent, it's easy to feel like you're not doing everything right. From sleepless nights to endless tantrums, it can seem like there's no end to the challenges that come with raising a child. But fear not! We've rounded up 50 amazing products that will make you feel like you're absolutely nailing this parenting thing.
""I was skeptical about the Owlet Smart Sock at first, but after using it for a few nights, I was hooked. It gave me so much peace of mind to be able to check on my baby's oxygen levels and heart rate from my phone.""
""The Baby Brezza Formula Dispenser made life so much easier for me when I went back to work. I could set it up at night and it would automatically mix and warm bottles for me in the morning. It saved me so much time and hassle.""
""I never knew how much I needed the DockATot until I tried it. My baby slept so much better in it, and I loved that I could take it with me wherever we went.""
© 2022 All rights reserved.
https://akash.mittal.blog/50-Parenting-Products-That-ll-Make-You-Feel-Like-a-Pro-Buzzfeed.html
#trending #parentingproducts #happyparents #familyfun ","","","linkedin","Dave's Academy","","","","","","2023-05-26-01-47-01-593","https://akash.mittal.blog/50-Parenting-Products-That-ll-Make-You-Feel-Like-a-Pro-Buzzfeed.html","https://akash.mittal.blog/images/50-Parenting-Products-That-ll-Make-You-Feel-Like-a-Pro-Buzzfeed.jpeg"
"2023-05-30 06:47 PM;","Picture this: a small team of data scientists working on a machine learning project. They are trying to develop an algorithm that can predict customer churn for a telecom company. They have access to a wealth of data, including customer demographics, call logs, billing information, and more. They spend months building, testing, and refining the model. Finally, they are able to achieve an accuracy rate of 95%. The telecom company is thrilled with the results and begins using the algorithm to identify customers who are at risk of leaving.
However, what if I told you that there is a new type of artificial intelligence that can not only predict customer churn, but can also generate entirely new ways to keep customers happy and loyal? This is called generative AI, and it is set to revolutionize the business world.
Generative AI is a subset of machine learning that involves training algorithms to produce new and original outputs based on certain inputs. In other words, instead of simply classifying data or predicting outcomes, generative AI can actually create something new.
One example of generative AI is the GPT-3 language model developed by OpenAI. This model can generate human-like text that is virtually indistinguishable from that written by a human. In fact, the model is so good that it has been known to fool people into thinking it was written by a human.
Generative AI has the potential to radically transform the way businesses operate. Here are three ways it can change business strategy:
https://akash.mittal.blog/How-Generative-AI-Changes-Strategy.html
#trending #GenerativeAI #Strategy #HarvardBusinessReview ","","","linkedin","Akash Mittal","","","","","","2023-05-26-01-47-01-593","https://akash.mittal.blog/How-Generative-AI-Changes-Strategy.html","https://akash.mittal.blog/images/How-Generative-AI-Changes-Strategy.jpeg"
"2023-05-30 07:47 PM;","By CNBC
Michelle was a busy working mother who had to juggle her job, household chores, and taking care of her two young children. She struggled to find time to relax, read a book, or catch up with friends. One day, she stumbled upon ChatGPT Bard, a chatbot designed to help people unwind and destress by generating thoughtful poems and quotes. She decided to give it a try.
To her surprise, ChatGPT Bard not only helped her unwind but also inspired her with beautiful words that uplifted her mood and gave her hope. She shared some of the poems with her friends, who were equally impressed. Michelle realized that chatbots like ChatGPT Bard were not just useful tools but also sources of creativity and connection.
If you're curious about how chatbots can improve your life, here are some quantifiable examples:
Chatbots are not just robots; they are your creative companions.
https://akash.mittal.blog/How-to-get-the-most-out-of-ChatGPT-Bard-and-other-chatbots.html
#trending #chatbots #AI #virtualassistants #personalizedexperience ","","","linkedin","Akash Mittal","","","","","","2023-05-26-01-47-01-593","https://akash.mittal.blog/How-to-get-the-most-out-of-ChatGPT-Bard-and-other-chatbots.html","https://akash.mittal.blog/images/How-to-get-the-most-out-of-ChatGPT-Bard-and-other-chatbots.jpeg"
